Location,Tags
Panipat,webdevelop php comput python webtechnolog webdevelop wordpress develop computersci associ
Madurai,webdeveloperfresherinternship php comput sourc eclips webtechnolog mysql webdevelop drupal entri
Palghat/Palakkad,webdevelop softwaresolut wordpress develop softwar pdf webtechnolog webdesign design entri
Gurgaon/Gurugram,webdevelop transform digitaltransform san webdevelop digitalmarket digit webtechnolog market entri
Chennai,webdevelop program webdevelop network develop webtechnolog program entri
Mumbai,webdeveloperintern applicationprogram cs program contentedit webtechnolog content studio softwareservic entri
Surat,webdevelop webdevelop mvc develop code webtechnolog architectur develop entri
Surat,phpwordpresswebdevelop develop code conceptu webtechnolog javascript jqueri webdevelop wordpress entri
Jalandhar,phpwebdevelop php sql phpdevelop python oracl webtechnolog operatingsystem webdevelop entri
Mumbai,jobpositionassociatewebdeveloperwebdevelop c sql email jqueri mvc sqlserver develop microsoft entri
Gurgaon/Gurugram,traineewebdevelopertest webtechnolog academ develop softwaretest who technic webdevelop train entri
"Kochi, Cochin/ Kochi/ Ernakulam",jrwebdevelop php wordpresscm webtechnolog cm webdevelop zendframework debug framework entri
Ahmedabad,webdeveloperjavatechnolog jsf jsp webtechnolog strut j2ee webdevelop educ javatechnolog entri
Remote,webdeveloperengin html webdevelop program testcas operatingsystem mysql cs javascript entri
Nasik,webdevelop webdevelop ajax php cs develop html wordpress softwaretest entri
"Mumbai, Vasai",webdeveloperintern webdesign webtechnolog troubleshoot compatibilitytest webdevelop design jqueri html entri
Hyderabad,phpwebdevelop ajax drupal manag xml webdevelop php javascript technologymanag entri
Ludhiana,webdeveloperintern php c analyticalskil oop webtechnolog troubleshoot webdevelop analyt entri
Indore,webdevelop corephp php contentmanag manag project oper crm core entri
remote,webdeveloperintern php cs oop webtechnolog webdevelop analyt html css entri
Pune,wordpresswebdeveloperinternshiptheleadersglobemedia contentmanag manag visualdesign code webtechnolog content media webdevelop entri
Mohali,webbackenddevelop jqueri backenddevelop mvc code debug wordpress projectmanag manag associ
Hyderabad,webdesigneranddevelop jqueri search searchengineoptim develop frontend optim analyticalskil webdesignanddevelop entri
Lucknow,seniorwebdesignerdevelop graphic productionsupport sourc seo webdesign webtechnolog cm webdevelop entri
Karur,webdeveloperwebdesign graphic contentmanag manag code webdesign webtechnolog webdevelop design entri
Pune,webdevelop php graphic webtechnolog media photoshop coreldraw print jqueri entri
Ahmedabad,webdevelop webtechnolog webdevelop jqueri html develop javascript htmljavascript entri
Kolkata,webmobileapplicationdevelopmentintern mysql applic develop technolog technologysolut design applicationdevelop program entri
Remote,associatewebdeveloperwordpress manag webdevelop php performancetest project html code projectmanag entri
Jaipur,webdevelop jqueri ajax webdevelop php computersci webdesign html comput associ
Mumbai,webdeveloperen html dbm webdevelop program develop javascript oop en associ
Mumbai (All Areas)(Chembur),fullstackwebdevelop netmvc html webdevelop develop mvc javascript webdesign netcor associ
Remote,webdevelop webdevelop develop applicationdesign googlecloudservic program aw googl webtechnolog associ
Ahmedabad,urgenthiringllwebdeveloperllimsgroup rubyrail aspnet php cs hire wordpress develop javascript associ
"Thane, Maharashtra, Pune, Maharashtra",reactjswebdevelop reactj webdevelop javascript develop html5b json data express associ
Remote,webdevelop webdevelop wordpresscm javascript responsivewebdesign responsivewebsit cs design webdesign associ
"Noida, Mumbai, Chennai, Gurgaon/Gurugram",fullstackwebdevelop develop versioncontrol javascript git end data sql improv midsenior
Mumbai (All Areas),webdevelop webdevelop html webtechnolog microsoft develop microsoftbiztalk biztalk c associ
Mumbai (All Areas),webdeveloperonly5year webdevelop api webdesign html c design angularj webtechnolog midsenior
Hybrid - Gurgaon/Gurugram,seniorwebdeveloperhtml5css3 webdevelop designpattern javascript html cs sass senior design midsenior
Bangalore/Bengaluru,webdevelop develop troubleshoot consult sql linux visualbas visual agil associ
Oman,webdevelop net develop jqueri php webtechnolog css webdevelop cs associ
New Delhi,webdevelop develop webdevelop webtechnolog cm associ
Calicut/Kozhikode,srwebdevelop architectur ajax sr performancetun control webdevelop versioncontrol autom associ
Patna,webdevelop object javafx develop nosql git objectorientedprogram sql testcas associ
"Noida, Uttar Pradesh",urgentlyrequiredwebdeveloperinnoida laravel php ajax javascript magento develop jqueri webtechnolog associ
"Mangaluru/Mangalore, Udupi",webdevelop jqueri troubleshoot webdevelop monitor webdesign javascript backend end associ
"Mangaluru/Mangalore, Udupi",webdevelop wordpress develop backend javascript jqueri webtechnolog monitor webdesign associ
Mumbai,webdevelop html python fme webdevelop program develop mvc javascript associ
Mumbai (All Areas),webdevelop nodej angularj net saml api webdevelop nosql oauth associ
Mumbai (All Areas),webdevelop nodej angularj microservic develop saml net nosql oauth associ
"Gurgaon/ Gurugram, Haryana",fullstackwebdevelop corephp apiintegr basic laravelphpframework html webdevelop fullstack integr midsenior
"Noida, Uttar Pradesh, Gurgaon/ Gurugram, Haryana, Chennai, Tamil Nadu, Mumbai (All Areas)",fullstackwebdeveloperreactnodenightshiftmastek angular nodej azur webservic node develop stack soap midsenior
Chennai,webdevelop jqueri microsoft manag offic webdevelop php msoffic mysql associ
Mumbai (All Areas),webdevelop nodej angular develop mssqldba html sqlserver cs c midsenior
"Kolkata, Mumbai, Hyderabad/Secunderabad, Pune, Chennai, Ahmedabad, Bangalore/Bengaluru, Delhi / NCR",fullstackwebdeveloperphplaravel php dbm mvcarchitectur webdevelop architectur develop mvc javascript associ
"Kolkata, Mumbai, New Delhi, Hyderabad/Secunderabad, Pune, Chennai, Bangalore/Bengaluru",sitecorexpdevelop sitecor deliveri softwaretest content projectdeliveri visual framework sql midsenior
"Noida, Delhi / NCR, Gaziabad",websoftwaredeveloperbpowfonoida bpo htmlcss goodenglishcommun javascript webdevelop joomla wordpress html entri
Kolkata,webmobileapplicationdevelop technologymanag netbean dbm manag develop mobileappl applic webtechnolog associ
Kolkata,webapplicationdevelop applic servic facebook javascript webdevelop html xml webapplicationdevelop associ
Kolkata,microsoftnetwebappsdevelop develop storedprocedur dbm webapplicationdevelop end procedur aspnet microsoft associ
Noida,softwareengineerwebapplicationdevelop html json webtechnolog frontend webdevelop webapplicationdevelop javascript develop associ
Bengaluru,seniorphpdeveloperwebportaldevelopmentmobl jqueri webdevelop mobil javascript mysql core senior html associ
"Noida, Ghaziabad, Delhi / NCR",openingforwebdeveloperintern webdevelop webapplicationdevelop webappl woocommerc wordpresscm cakephp cm framework entri
"Temp. WFH - New Delhi, Delhi / NCR",webdesigneranddeveloperintern webdesign webdevelop ux htmlandcss usag graphicdesign artdirect graphic entri
"Alleppey/ Alappuzha, Kerala, Cherthala, Kerala, Thiruvalla, Kerala",laravelwebdevelop laravelphpframework phplaravel php laravel laravelphp webtechnolog framework webdevelop entri
Mumbai (All Areas),webdevelop webdevelop javascript html cs webtechnolog develop css associ
Bangalore/Bengaluru(Jayanagar +9),webdevelop phpdevelop webdevelop phpdevelop php webdesign frontend mysql cs associ
Kolkata(Salt Lake),webdevelopersrwebdevelop webdevelop websitepromot applic sr develop jscript reactj nodej associ
Bangalore/Bengaluru,fullstackwebdevelopernet proficiencyinfrontendtechnologiessuchasjavascript net javascript api restapidesign cs rest webdevelop associ
Remote,webdevelop javascript webapplicationdevelop webdevelop php pythondevelop applicationdevelop python phpdevelop associ
Kolkata,webdevelop php webtechnolog photoshop webdevelop design jqueri psd html associ
Kolkata,webdevelop php laravel mysql webtechnolog webdevelop codeignit wordpress develop senior
"Kolkata, United States (USA)",seniorwebdevelop javascript xml develop dbm mysql sdlc ajax html midsenior
"Kolkata, Pune",bigcommercewebdevelop html webtechnolog webdevelop javascript develop jqueri css mysql associ
Kolkata,webdevelop lifecycl comput webtechnolog developmentlifecycl webdevelop softwaredesign design softwaredevelop associ
Kolkata,webdevelop applic system applicationdesign content wordpress managementsystem webtechnolog design associ
Kolkata,webdevelop document softwaredevelopmentlifecycl develop softwaredevelop webdevelop debug technicaldocument technic associ
Kolkata,webdeveloperwordpress manag webtechnolog webdevelop ecommerc wordpress develop associ
Kolkata,webdevelop develop cs css php webtechnolog html webdevelop mysql associ
Kolkata,phpwebdevelop php apach phpdevelop sourc webtechnolog mysql cm webdevelop associ
Kolkata,phpwebdevelop mysql phpwebdevelop develop technolog javascript jsp sql core associ
"Kolkata, Jodhpur",webdevelop php xhtml webtechnolog mysql applicationdevelop webdevelop jqueri drupal entri
Kolkata,webdevelop interpersonalskil webtechnolog scienc webdevelop comput javascript develop deploy associ
Kolkata,webgisdevelop bootstrap postgresql jqueri webdevelop technolog technologymanag gi manag associ
Kolkata,phpwebdevelop php apach phpdevelop sourc webtechnolog mysql cm webdevelop entri
Kolkata,webdevelop php json data webtechnolog cm webdevelop jqueri datastructur associ
Kolkata,webdeveloperwordpressdevelop technolog informationtechnolog code wordpress webdevelop ecommerc wordpressdevelop webtechnolog associ
Bangalore/Bengaluru,interactionstudiowebdevelop manag webanalyt ticket webdevelop javascript enterprisecontentmanag css develop associ
Bangalore/Bengaluru,webdevelop microsoft digit seo illustr graphic develop emailmarket offic associ
Kolkata,webservicedevelop rdbm develop webservic databasemanag sql dbm developingwebappl manag entri
Kolkata,webdevelop develop webtechnolog webdevelop entri
Chennai,fullstackwebapplicationdevelop javascript stack applic css develop java microsoft fullstack associ
Not Specified,webapplicationdevelop php sql program webtechnolog mysql applicationdevelop webdevelop jqueri associ
Lucknow,webapplicationdevelop softwar informationtechnolog applicationprogram softwareservic program develop webappl program entri
Chennai,salesforcelightningwebcomponentsapplicationdevelop webtechnolog datamodel debug salesforc technic lightningsalesforc sfdc model midsenior
Chennai,salesforcelightningwebcomponentsapplicationdevelop webtechnolog datamodel debug salesforc applic webtechnolog develop technic associ
Chennai,salesforcelightningwebcomponentsapplicationdevelop webtechnolog datamodel debug salesforc applic webtechnolog develop data associ
Chennai,salesforcelightningwebcomponentsapplicationdevelop debug businessprocess webtechnolog datamodel salesforc process scheduleapex sfdc associ
Chennai,salesforcelightningwebcomponentsapplicationdevelop datamodel technicaldesign lightingcomponentdevelop salesforcelightn technic apex model light associ
Bangalore/Bengaluru,openingforjuniorsoftwaredevelop softwaredevelop engin develop reactj javascript aspnet c flutter entri
"Srinagar, Kolkata, Bangalore/Bengaluru",juniorwebdevelop css javascript jqueri end adob front visual design associ
Bengaluru,leadproductengineerfullstackwebdevelop scrum productdevelop fullstack webdevelop scienc accessori comput computersci midsenior
Bengaluru,srprogrammerfullstackwebdevelop applic sr accessori api webdevelop develop softwar backend associ
"Pune, Bengaluru",webdevelop program javascript write code webdevelop html technic program associ
Bengaluru,tmwebdevelopmentaspnetc wpf sql applic webdevelop script technic webtechnolog dbm associ
Bengaluru,webdevelopmentengineerleadingonlinetaxiaggreg api design code webdevelop nosql manag technologymanag leadership entri
Bengaluru,webdevelopmentengineerenterpriseassoci tool ux computersci comput webdevelop css system scienc midsenior
"Pune, Bengaluru",webdevelop css javascript cs webdevelop html softwaretest technic php associ
Bengaluru,webdevelop code webdevelop graphic technic javascript php softwaretest layout associ
Bengaluru,tmwebdevelopmentaspnetc net wcf webtechnolog aspnet performancetun script perform applicationdevelop associ
Bengaluru,webdevelop softwaretest code layout cs webtechnolog javascript graphic css associ
Bengaluru,tmwebdevelopmentaspnetc develop sql businessintellig wcf tm applic wpf webtechnolog associ
"Pune, Bengaluru",webdevelop code webdevelop graphic technic javascript program php layout associ
Bangalore/Bengaluru,embeddedandwebdevelopmentprofession webtechnolog embeddedsystem webdevelop embeddeddevelop crm san javascript automot senior
Bangalore/Bengaluru,leadfrontendemailwebdevelop microsoft tool word leadership graphic end front frontend midsenior
Surat,phpwebdevelop php sql phpdevelop oracl cv webtechnolog mysql troubleshoot associ
Remote,technicalarchitectwebdevelop webdevelop architectur technic webtechnolog develop technicalarchitectur technicalarchitect entri
amod,technicalwebdevelopmentintern dataentri digit data market webtechnolog technic seo adword associ
"Bangalore/Bengaluru, Bengaluru",engineerwebfrontend jqueri webdevelop engin architectur applic algorithm mvc data entri
Bengaluru,engineerwebfrontend webtechnolog microsoft webdevelop engin debug javascript linux develop entri
Bangalore/Bengaluru,caliperfrontendwebdevelop procur mine telecom frontend git javascript epc fmcg entri
Trivandrum,traineewordpressdevelop php webtechnolog mysql webdevelop traininganddevelop wordpress develop javascript entri
Bangalore/Bengaluru,dotnetfullstackdevelopmentapplicationdevelop businessprocess webapplicationdevelop frontend databasedesign consult webtechnolog process design associ
Bangalore/Bengaluru,dotnetfullstackdevelopmentapplicationdevelop businessprocess webapplicationdevelop frontend databasedesign consult stackdevelop process end associ
Bangalore/Bengaluru(Jalahalli West),juniorwebdevelop aspnetmvc framework develop sqlserver entityframework ssm visual aspnet entri
Mumbai,phpwebdevelop phpdevelop cm jqueri mysql linux webdevelop wordpress php entri
Mumbai,webdeveloperanalyst marketingoper clientrelationship digitalmarket webdevelop client develop applicationdevelop digit associ
"Kolkata, West Bengal",shopifywebdevelopershopifywebsiteexpert woocommerc shopifythemeintegr shopifyliquid liquidcod magentocommerc interfac develop apiintegr associ
"Pune, Maharashtra, Mumbai (All Areas)",hiringforfullstackwebdeveloperinpunemumbai develop reactj webtechnolog stack fullstackdevelop webdevelop fullstack hire senior
"Kolkata, Mumbai, New Delhi, Hyderabad/Secunderabad, Pune, Chennai, Bangalore/Bengaluru",webspecialist webapplicationdevelop content experiencedesign webappl objectorientedprogram publish searchengin lifesci associ
Mumbai,webdevelop javascript erp develop mysql agil ajax html php associ
Kochi/Cochin,webdevelop visualdesign visual seo develop androidapplicationdevelop design code conceptdevelop associ
"Delhi, new delhi,delhi",wordpresswebdevelop seo ppc market mediamarket socialmediamarket webdevelop wordpress googleanalyt senior
Mumbai,phpwebdevelop program php phpwebdevelop webtechnolog html webdevelop program jqueri associ
Hyderabad/Secunderabad,webdevelop develop webtechnolog softwaretest webdevelop web develop test midsenior
Mohali,webdevelop php wordpresscm webtechnolog cm webdevelop architectur wordpress develop associ
Guwahati,webdevelop jqueri ajax xml webdevelop php photoshop javascript html associ
Mumbai,webdevelop css jqueri javascript html api webtechnolog webdevelop webapplicationdevelop associ
Chennai,webdevelop digit media testcas applicationdesign script webdevelop case digitalmedia associ
Mumbai,webdeveloperassoci webtechnolog jqueri html webdevelop vuej oop javascript cs entri
Indore,webdevelop php cs applicationdevelop css develop program webtechnolog mysql entri
Patna,phpwebdevelop php mvc develop informationtechnologymanag webtechnolog mysql webdevelop informationtechnolog associ
Remote,fullstackwebapplicationdevelopersoftwareengin softwareengin sql c python stack webtechnolog fullstack code entri
Pune,webdevelop php cs program object searchengin oop code webtechnolog associ
Chandigarh,webdevelop php cakephp webtechnolog technic applicationdevelop cm mysql design associ
"Delhi, padampur",webdevelop php xml seo magento webtechnolog css html webdevelop associ
Surat,webdevelop sql dhtml webtechnolog webdevelop jqueri c htmlcss ajax associ
Chennai,webdevelop webtechnolog develop technic webdevelop entri
"Mumbai, Mumbai",webdevelop aspnet asp webdevelop xml php net develop client associ
Delhi,webdeveloperphpaspaspnet server serv php wordpresscm administr webtechnolog serveradministr cm associ
Delhi,phpwebdeveloper12yr php xhtml phpdevelop code webtechnolog mysql dom cm entri
Mumbai,webdevelop net dhtml webtechnolog aspnet script html server serv associ
Surat,webdevelop sql entiti comput dhtml webtechnolog webdevelop jqueri framework associ
Not Specified,webdevelop storedprocedur facebook javascript android trigger webdevelop soa iphon associ
"Kolkata, Mumbai, Hyderabad/Secunderabad, Pune, Ahmedabad, Chennai, Bangalore/Bengaluru, Delhi / NCR",arcgiswebdeveloperpythonsqlserv arcgisweb server webdevelop serv cicd develop sql microsoft associ
"Kolkata, Mumbai, Hyderabad/Secunderabad, Pune, Ahmedabad, Chennai, Bangalore/Bengaluru, Delhi / NCR",webdeveloperangular javascript releasemanag html webtechnolog webdevelop angular develop continuousintegr midsenior
"Hybrid - Kolkata, Hyderabad/Secunderabad, Pune, Chennai, Bangalore/Bengaluru, Delhi / NCR, Mumbai (All Areas)",webmethodsdevelop develop soap webmethodsintegrationserv webdevelop webtechnolog method webmethod midsenior
New Delhi,hiringwebdevelopmenttrainerswordpressphppython django wordpress php angularj webtechnolog reactj webdevelop python entri
"Kolkata, Sec-V",fresherbusinessdevelopmentexecutivewebconsult verbalcommun goodenglishcommun leadgener websitesal internationalbpo golang intern webtechnolog entri
Chennai,softwareengineerfrontendwebdevelop develop softwaredevelop webdevelop softwar front frontend end unit associ
Bangalore/Bengaluru,webapplicationdevelop frontend webapplicationdevelop cssandjavascript reactj net develop angular applicationdevelop associ
"Hyderabad/Secunderabad, Ahmedabad, Chennai, Bangalore/Bengaluru",applicationdeveloperwebcontentmanag sitecor webtechnolog webdevelop develop applic manag contentmanag content midsenior
"Kochi/Cochin, Bangalore/Bengaluru, Trivandrum/Thiruvananthapuram",webapplicationdevelop hrsd softwaretest developmenttest applicationdevelop webdevelop postgresql webtechnolog javascript associ
Bangalore/Bengaluru,webapplicationdevelop dom django webapplicationdevelop webdevelop linux javascript python html associ
Bangalore/Bengaluru,internwebapplicationdevelop webapplicationdevelop applic applicationdevelop github develop webdesign design digit entri
Remote,angulardeveloperwith3yearsofexpworkingwithwebdevelop rxj angular git python angularj postgresql scrum react associ
Gurgaon/Gurugram,engineeringmanagerwebdevelopmentframework engineeringmanag backbonej postgresql framework model mysql develop engin midsenior
Hyderabad/Secunderabad,wordpressdeveloperwebmobiledevelopmentphpmysql restfulapi mobiledevelop webtechnolog html wordpressdevelop webdevelop develop mobileappdesign associ
Bangalore/Bengaluru,sapabapwebdynprosoftwaredevelopmentengin sap sapabap webdynpro webtechnolog client webdevelop teamhandl develop midsenior
"New Delhi, Delhi, Delhi / NCR",reactjsdevelop nodej softwaredevelop javascript reactj softwareengin frontend backenddevelop develop entri
Mohali,phpdevelop analyt phpdevelop datastructur webtechnolog javascript code data corephp entri
Kolkata,businessdevelopmentexecut businessdevelop san digit adword market nda webtechnolog seo entri
Bangalore/Bengaluru,sapui5developmentapplicationdevelop sap sapui5 jqueri javascript sapui5 responsivewebdesign webtechnolog responsivewebsit associ
Hybrid - Gurgaon/Gurugram,seniorwebdevelop reactj javascript uidevelop webtechnolog senior cs webdevelop ui midsenior
New Delhi,seniorwebdevelop cs develop javascript scienc webtechnolog senior joomla css associ
Noida,webdevelop javascript softwaredesign develop media applicationdevelop mvc socialmedia webtechnolog associ
"New Delhi, Delhi(Uttam Nagar +4), Delhi / NCR",frontendjavascriptjquerywebdevelop jqueri javascript html webtechnolog frontend webdevelop develop css associ
Mumbai,webdevelop mvcarchitectur html python webtechnolog webdevelop architectur javascript develop entri
Shillong,webdevelop html webtechnolog jsp webdevelop javascript drupal develop joomla associ
Mumbai,webdevelop webtechnolog frontend webdevelop develop end front backend php entri
Bangalore/Bengaluru,softwareengineeriifrontenddeveloperjavatypescript javascript git develop webdevelop typescript perform automationtest agil entri
Bangalore/Bengaluru,softwaredevelopercangular develop softwaredevelop multithread webdevelop system consult technic nunit associ
Jasola,webdevelop css webdevelop html ajax develop cs webtechnolog associ
Ahmednagar,webdevelop html webdevelop program develop javascript visual android visualdesign associ
"Kuwait, Middle East",seniorwebdevelopersharepoint designdevelop webtechnolog businessappl senior businessanalysi analysi webdevelop design associ
"Pune, Maharashtra(Hadapsar)",webdevelop fullstack designpattern webapi serv sql develop server unittest associ
"Greater Noida, Uttar Pradesh, Delhi / NCR",fullstackwebdevelop php framework codeignit laravel webdevelop fullstack backenddevelop phpdevelop associ
Mumbai,frontendwebdeveloperhtmlcssjavascript angularj javascript develop ui frontendwebdesign webtechnolog front gimp associ
United Kingdom (UK),fullstackwebdevelop php develop stack backend frontenddevelop wordpress backenddevelop front senior
Ernakulam,webdevelop html javascript develop corephp cm wordpress cs webtechnolog entri
Noida(Sector-2 Noida),webdevelop codeignit git codeigniterframework wordpress html webdevelop develop javascript entri
"Noida, Kanpur, Lucknow",webdevelop cssandjavascript webdevelop mvc javascript html sqlserver angular cs associ
Noida,webdevelop jqueri softwar wordpress webapplicationdevelop webdevelop php softwaredevelop applicationdevelop associ
Mumbai,webdevelop drupal wordpress webdevelop php mvc code anim backend associ
Remote,webdevelop wordpress manag develop webtechnolog webdevelop associ
Ahmedabad,webdevelop comput javascript scienc tool webdevelop cm php webtool associ
Coimbatore,webdevelop html webtechnolog jsp framework webdevelop applicationdevelop core develop associ
Hyderabad/Secunderabad,seniorwebdevelop webmainten webapplicationdevelop html webdesign php wordpress manag websitemanag associ
Noida,webdevelop engin field develop javascript code troubleshoot html cs associ
Delhi / NCR,webdeveloperphpmvcsymfoni angularj develop symfoni ldap linux reactj ooad oop midsenior
Delhi / NCR,pythonwebdeveloperdjangoflask applicationdesign controlsystem schema versioncontrol javascript django applicationdesign dbm midsenior
Mumbai,frontendwebdeveloperhtmlcssjavascriptpremierinstitut frontenddesign framework photoshop develop durand frontendwebdesign ux frontend associ
New Delhi,pythonwebdeveloperdjangoflaskorm applicationsimplement javascript develop django dbm orm flask applicationintegr associ
Bangalore/Bengaluru,fullstackwebdevelop visualdesign visual develop javascript end design code html associ
"Kottayam, Kerala",wordpresswebdevelop shopifi wordpress develop webtechnolog webdevelop associ
"Hubli, Mangaluru/Mangalore, Mysore/Mysuru, Bangalore/Bengaluru, Belagavi/Belgaum",cdeveloperweb webdevelop system analyt sourc agil analyt html systemprogram associ
"Kolkata, Mumbai, New Delhi, Hyderabad/Secunderabad, Pune, Chennai, Bangalore/Bengaluru",webdevelop develop webtechnolog webdevelop associ
"Kolkata, Mumbai, New Delhi, Hyderabad/Secunderabad, Pune, Chennai, Bangalore/Bengaluru",dotnetfullstackwebdevelop net jqueri microsoft django webdevelop aspnet netfullstack enterpris associ
"Kolkata, Mumbai, New Delhi, Hyderabad/Secunderabad, Pune, Chennai, Bangalore/Bengaluru",webdevelop git develop jqueri css soap webtechnolog svn cs associ
"Kolkata, Mumbai, New Delhi, Hyderabad/Secunderabad, Pune, Chennai, Bangalore/Bengaluru",webdevelop php develop webtechnolog webdevelop associ
"Kolkata, Mumbai, New Delhi, Hyderabad/Secunderabad, Pune, Chennai, Bangalore/Bengaluru",webdevelop manag research webtechnolog side webdevelop ftp develop associ
"Kolkata, Mumbai, Hyderabad, Pune, Gurgaon, Chennai, Bengaluru",webmethodsdevelop xml develop sql agil jm applic sdlc webtechnolog midsenior
Kolkata,urgentopeningforthepositionofwebdevelop php webtechnolog mysql ecommerc design jqueri webdevelop html entri
"Kolkata, Mumbai, New Delhi, Hyderabad/Secunderabad, Pune, Chennai, Bangalore/Bengaluru",mernstackdevelop analyt analyt develop git mernstack architectur mongodb stack midsenior
"Kolkata, Mumbai, Hyderabad/Secunderabad, Lucknow, Ahmedabad, Chennai, Delhi / NCR, Bangalore/Bengaluru",fullstackdeveloperphplaravel php applic laravel develop javascript webapplicationdevelop sql applicationdevelop associ
Canada,frontenddeveloperwebappl webappl materialui javascript materi develop responsivedesign ui rwd associ
Gurgaon/Gurugram,frontendangulardeveloperwebapp frontenddevelop develop angular agil agilemethodolog aw frontend webappl associ
Gurgaon/Gurugram,webapplicationdeveloperjavafrontend webdevelop java front j2ee applic frontend end develop midsenior
