Location,Tags
"Kolkata, Mumbai, New Delhi, Hyderabad/Secunderabad, Pune, Chennai, Bangalore/Bengaluru",softwareengin continuousintegr corejava softwaredesign databasedesign agiledevelop designdevelop datastructur j2ee associ
"Kolkata, Mumbai, New Delhi, Hyderabad/Secunderabad, Pune, Chennai, Bangalore/Bengaluru",softwareengin msdynamicscrm analyt migrat crm softwareengin product data dynam associ
"Kolkata, Mumbai, New Delhi, Hyderabad/Secunderabad, Pune, Chennai, Bangalore/Bengaluru",softwareengin manag softwar agil oracl technologymanag sql softwareengin html execut
"Temp. WFH - Kolkata, Hyderabad/Secunderabad, Pune, Ahmedabad, Chennai, Bangalore/Bengaluru, Delhi / NCR(Mohan Co-operative), Mumbai (All Areas)",softwareengin oop aspnetmvc jqueri sql architectur mvc javascript softwareengin associ
"Chennai, Bangalore/Bengaluru",softwareengin applic develop selenium data oracl agil tool testingtool associ
"Hyderabad/Secunderabad, Bangalore/Bengaluru",softwareengineerleaddellboomichennaibangalorebhuban develop boomi leadership softwar dellboomi softwareengin dellboomidevelopmentadvanc associ
Kolkata,associatesoftwareengineerfresh c c html sql engin javascript magento softwareengin entri
Chennai,gcpsoftwareengin sqoop github gcp monitor analyt jira softwar teradata associ
Chennai,softwareengin cloud softwareengin spring springboot boot softwar microservic midsenior
Chennai,softwareengin softwar rest end frontend ux front softwareengin restapi associ
Mumbai (All Areas),softwareengin softwaretest softwar mobiletest softwareengin mobiletestingmumbaiimmediatejoin associ
Coimbatore,associatesoftwareengineerfresh softwareengin unittest softwar softwarequ softwaretest softwareprogram applicationsoftwar qualiti entri
"Hyderabad/Secunderabad, Hyderabad",softwareengin softwar softwareengin softwareengineerii associ
"Bangalore/ Bengaluru, Karnataka",softwareengin c wirelesscommun comput develop network wireless softwareengin computernetwork entri
"Kolkata, Mumbai, New Delhi, Hyderabad/Secunderabad, Pune, Chennai, Bangalore/Bengaluru",softwareengin performancetun perform oracl softwaredevelop develop sql softwaredevelopmentlifecycl lifecycl execut
"Kolkata, Mumbai, New Delhi, Hyderabad/Secunderabad, Pune, Chennai, Bangalore/Bengaluru",graduatesoftwareengin improv manag develop softwaredevelop teambuild agil technolog data associ
"Kolkata, Mumbai, New Delhi, Hyderabad/Secunderabad, Pune, Chennai, Bangalore/Bengaluru",graduatesoftwareengin financialmarket teambuild financ datastructur lifecycl developmentlifecycl softwareengin data associ
"Kolkata, Mumbai, New Delhi, Hyderabad/Secunderabad, Pune, Chennai, Bangalore/Bengaluru",apisoftwareengin manag cisco api softwar cloud bank midsenior
"Kolkata, Mumbai, Hyderabad/Secunderabad, Pune, Chennai, Ahmedabad, Bangalore/Bengaluru, Delhi / NCR",softwareengineerangularjsjavascript angularj jqueri ui softwar designpattern javascript html softwareengin associ
"Bangalore Rural, Karnataka, Bangalore/Bengaluru",softwareengin softwareengin softwar c linux midsenior
Bangalore/Bengaluru,softwareengin linux productmanag unittest softwareengin network unix debug data midsenior
Bangalore/Bengaluru,softwareengin javascript git code document technicaldocument computersci technic softwaretest associ
Bangalore/Bengaluru,softwareengin cloud program softwar program side softwareengin softwaretest debug entri
Bangalore/Bengaluru,softwareengineersearch scala search perform softwar productdesign unit unittest softwaretest associ
Hybrid - Bangalore/Bengaluru,softwareengineernet net github cloud softwar azurecloud splunk c microsoftazur associ
Bangalore/Bengaluru,experiencedsoftwareengin softwareengin applic engin develop analysi machinelearn applicationdevelop deeplearn senior
Bangalore/Bengaluru,softwareengin linux uidevelop linuxkernel softwar debug microsoftwindow oop object associ
Bangalore/Bengaluru,softwareengin net softwaredevelop develop softwar odata architectur api applic midsenior
Remote,softwareengin java spring python softwar c sql softwareengin interperson associ
Bangalore/Bengaluru,softwareengin linux systemprogram c rto softwareengin codec framework program associ
Bangalore/Bengaluru,softwareengin mobiledevelop softwar mobileappl applicationdevelop mobileapplicationdevelop android softwareengin sdk entri
Bangalore/Bengaluru,softwareengin linux debug postgresql loadbalanc jira softwar microsoftwindow git midsenior
Bangalore/Bengaluru,softwareengineerangular angular reactj typescript softwaredevelop softwareengin softwar develop associ
"Bhopal, Madhya Pradesh",softwareengineeremailmarket communicationskil adapt html mta teamplay manag problemsolv analyt entri
"Hybrid - Kolkata, Ahmedabad, Bangalore/Bengaluru",hiringsoftwareengineersfresherexperiencedboth hire comput softwar computerknowledg communicationskil goodcomputerknowledg goodcomputerknowledgecommunicationskil associ
Kochi/Cochin,softwareengin c c comput softwareengin computervis deeplearn softwar algorithm entri
"Noida, Hyderabad/Secunderabad, Bangalore/Bengaluru, Mysore",softwareengineeraspnetmvc net uml javascript mvc jqueri sqlserver c angularj associ
Bangalore/Bengaluru,softwareengin http troubleshoot activedirectori oper directori sql plan linux associ
Kolkata(New Town),softwareengin c frontend backend javascript matlab github gitlab softwar associ
Hybrid - Bangalore/Bengaluru,softwareengin c c linuxkernel applic softwar kernel softwareengin datastructur associ
"Hyderabad/Secunderabad, Chennai, Bangalore/Bengaluru",softwareengineerfreshersbulkhir softwaredevelop softwareservic softwareengin softwareengin softwar bulk informationtechnolog softwaredesign associ
Chennai,softwareengineerhthd improv java analyt softwar exploratorytest autom agil qualityimprov associ
Chennai,softwareengin perform functionaltest javascript selenium code sql function agil midsenior
Chennai,softwareengineerhthd tool productionsupport manag rootcaus process softwar agil schedul associ
Chennai,softwareengin sourc code opensourc shellscript sql softwareengin script monitor midsenior
Pune,softwareengin consult softwar analyt xml linux dataconvers data python associ
Noida,softwareengin reactj c css aspnet agil webdevelop html mvc associ
"Hybrid - Pune, Maharashtra",jobopeningsforsoftwareengineerpun cognostm1 plsql softwar tm analyt dmr plan cogno associ
"Hybrid - Hyderabad/Secunderabad, Bangalore/Bengaluru",softwareengineerfinop finop msoffic microsoftofficesuit microsoft offic softwar cloud python associ
"Kolkata, Mumbai, New Delhi, Hyderabad/Secunderabad, Pune, Chennai, Bangalore/Bengaluru",softwareengin scrum rootcaus cloudcomput softwar agil comput rootcauseanalysi monitor senior
"Kolkata, Mumbai, New Delhi, Hyderabad/Secunderabad, Pune, Chennai, Bangalore/Bengaluru",softwareengin unittest jqueri ajax softwar visualstudio autom dbm sql associ
"Kolkata, Mumbai, Hyderabad/Secunderabad, Pune, Chennai, Ahmedabad, Delhi / NCR, Bangalore/Bengaluru",softwareengineercdesktop c visual desktopappl visualstudio objectorientedprogram softwar studio microsoftwindow entri
Hyderabad/Secunderabad,softwareengineerservicenow systemtest nosql xml machinelearn javascript html json unittest associ
Hyderabad/Secunderabad,softwareengin assur qualityassur jm linux qualitymanag sdlc jsp data associ
Mumbai,softwareengin framework softwar analyt entiti xml windowscommunicationfound javascript sql midsenior
Hybrid - Hyderabad/Secunderabad,softwareengineernetwpf net wpf softwareengin softwar associ
Chennai(Anna Nagar Extension),openingforsoftwareengineernetangularatchennai aspnet angular net github serv softwar microsoft sql associ
Chennai,softwareengin java dbm angular softwar boot scienc agil oop associ
Hyderabad/Secunderabad,softwareengin dbm sql backend softwar selenium agil queri java associ
Hyderabad/Secunderabad,softwareengin mysql cogno perl sql oracl dbm telecom softwareengin associ
Remote,softwareengineerangular softwareengineerangularremot associ
Gurgaon/Gurugram,softwareengin softwarequ agil softwareengin financialservic tdd process qualiti java associ
Chennai,softwareengin system code financialservic systemanalysi middlewar applicationdevelop develop datamanag associ
Coimbatore,aspnetcoremvcsoftwareengin aspnet code wcf sql dbm design sqlite softwar associ
Chennai,softwareengin apachetomcat linux function postgresql softwar cassandra sql softwareengin associ
Chennai,softwareengin softwaredevelop softwareengin rpc terraform sql languag develop webservic associ
Chennai,softwareengin softwareengin softwaredevelop develop agil aw cd engin productdevelop associ
Chennai,softwareengin softwaredevelop github softwar api webservic dynamodb nodej python associ
Pune,softwareengineernet microsoftnet windowsapplicationdevelop webapplicationdevelop ooad html softwar c webdevelop associ
Hybrid - Chennai,softwareengin net netcor program core develop angular dotnetdevelop program associ
Bangalore/Bengaluru(Jigani),bbrcitsoftwareengin aw sql ml softwareengin softwar associ
"Kolkata, Mumbai, New Delhi, Hyderabad/Secunderabad, Pune, Chennai, Bangalore/Bengaluru",softwareengin distributionsystem process javascript scala microservic softwar distribut alteryx associ
"Kolkata, Mumbai, New Delhi, Hyderabad/Secunderabad, Pune, Chennai, Bangalore/Bengaluru",softwareengin cloud dataprocess softwar process distribut data javascript scala associ
Kolhapur,softwareengin graphic mssql jqueri code javascript agil winform scrum midsenior
Remote,pegasoftwareengin softwar agil analyt developmentlifecycl softwaredevelop export framework autom associ
Remote,softwareengineerjavascript front onlineresearch microsoft javascript softwareengin usag processor dataprocess associ
Bangalore/Bengaluru,softwareengineeranddevelop socketprogram system socket c program develop program softwar midsenior
"Kolkata, Mumbai, Hyderabad/Secunderabad, Pune, Chennai, Ahmedabad, Bangalore/Bengaluru, Delhi / NCR",softwareengineernetc c azur webapi api sql sqlserver serv softwar associ
Remote,softwareengin java springboot spring angular sql softwar boot nosql associ
Remote,softwareengin c linux softwar kernel softwareengin linuxkernel midsenior
"Kolkata, Pune, Ahmedabad, Chennai, Bangalore/Bengaluru, Delhi / NCR, Mumbai (All Areas)",softwareengin mdm profise govern datagovern softwar microsoftazur data softwareengin associ
Bangalore/Bengaluru,softwareengin linux distribut applicationdevelop c technic softwareengin technicaldocument perform midsenior
Bangalore/Bengaluru,engineersoftwar word code develop systemtest msoffic integrationtest engin system associ
Bangalore/Bengaluru,softwareengin css jqueri javascript html wcf webtechnolog mvc ssr associ
Hyderabad/Secunderabad,softwareengineerc assur testcas debug softwaretest manag xml datastructur softwar associ
Hybrid - Bangalore/Bengaluru,softwareengin nodej fullstack api reactj integr softwareengin stack softwar midsenior
"Mumbai, Bangalore/Bengaluru",softwareengineerprog unix applicationsupport applicationsupportunix python secur directoryservic script softwar associ
Chennai,softwareengin cti salesforc sdlc code financialservic softwareengin softwar debug entri
"Hybrid - Noida, Uttar Pradesh",softwareengin softwareengin javascript vuej sql softwar c aspnet engin entri
Hybrid - Mumbai (All Areas),softwareengin reactj nodej html softwareengin cs softwar mongodb css entri
"Hyderabad/ Secunderabad, Telangana",softwareengin softwareengin softwar qualificationanygraduatewith50percentageabovefrom2017to2023areelig entri
Kochi/Cochin,softwareengin developingsoftwar computervis python map c comput develop softwar entri
Bangalore/Bengaluru,softwareengin medicalinsur financ insur lifecycl technic packag developmentlifecycl softwareengin entri
Bangalore/Bengaluru,softwareengin assur linux softwaretest manag jira qualityassur box softwar associ
Bangalore/Bengaluru,softwareengin dilig debug qualitystandard softwar qualityassur game softwareqa investig associ
Bangalore/Bengaluru,softwareengineeriiiseiii html technic sdlc scienc comput javascript jqueri troubleshoot associ
Bangalore/Bengaluru,softwareengin scrum linux design sql unittest postgresql softwareengin softwar associ
Bangalore/Bengaluru,softwareengineerlim lim softwareengin queri serv sql server crystalreport windowsadministr associ
Bangalore/Bengaluru,softwareengineerprogress4gl lifecycl technic medic agil softwareengin employeeengag medicalinsur develop associ
Bangalore/Bengaluru,softwareengineernetcangular javascript analyt develop troubleshoot code sql applicationdevelop angular associ
Bangalore/Bengaluru,softwareengin javascript salesforc cloudcomput troubleshoot microsoft html softwareengin softwar associ
Bangalore/Bengaluru,csoftwareengin program architectur matlab simulink interpersonalskil interpersonalskil architecturaldesign automot associ
Remote,softwareengineerdatafabr c cloudtechnolog api sqlserver kubernet fabric git data associ
Bangalore/Bengaluru,softwareengineerreactui applicationdevelop intellig agil javascript softwareengin perform consult cs associ
Bangalore/Bengaluru,experiencedsoftwareengin react c c css c visualstudioid vc redux midsenior
Bangalore/Bengaluru,experiencedsoftwareengineerc c linux intellig systemsoftwar softwaretest softwaredevelop develop artificialintellig midsenior
Bangalore/Bengaluru,softwareengineerctcpipprotocolstack c softwareengin dn unix tcp softwaredesign design data associ
Bangalore/Bengaluru,softwareengineerctcpipprotocolstack softwaredesign softwar vpn ip data tcp softwareengin datastructur associ
Bangalore/Bengaluru,softwareengineernetcoreazur net tsql develop nativ core frontend frontenddevelop reactj midsenior
Bangalore/Bengaluru,softwareengineerservicenow servicenow softwar cd softwaretest administr soap softwareengin analyt midsenior
Bangalore/Bengaluru,softwareengineerassetvisu fullstackdevelop plant softwareengin cd queri cd sql develop associ
Bangalore/Bengaluru,softwareengineeradob adobeexperiencemanag akamai softwareengin adobeexperiencemanag serv server cif process associ
"Hybrid - Bangalore Rural, Karnataka, Bangalore/Bengaluru",softwareengin java api react spring softwar softwareengin reactj midsenior
Bangalore/Bengaluru,softwareengin objectorientedprogram interfac manag multithread softwar debug softwaretest oop associ
Nagpur,softwareengin javadevelop datastructur mysql css springboot softwareengin hibern javascript midsenior
Bangalore/Bengaluru,softwareengin selenium program program microservic nosql automationtest objectorientedprogram softwar midsenior
Bangalore/Bengaluru,softwareengin applicationsupport open nosql softwareengin sourc sdlc postgresql opensourc midsenior
Bangalore/Bengaluru,programmeranalystsoftwareengineerbusinessanalyst manag softwar datamanag socialmedia program data businessanalysi technologymanag associ
Bangalore/Bengaluru,softwareengin linux open troubleshoot scrum agil softwareengin sourc unix associ
Bangalore/Bengaluru,softwareengin linux scrum troubleshoot manag softwar agil sourc code associ
Chennai,softwareengin softwar webservic queri distribut data sqlqueri sql softwareengin associ
Chennai,softwareengineernetcjavascript applicationdevelop c net javascript softwareengin consult object design associ
"Jaipur, Bangalore/Bengaluru",softwareengineerjavascript angularcli enterpris vuej bootstrap microservic reactj grunt applicationintegr associ
Bangalore/Bengaluru,softwareengineerreactui cs performancetun intellig perform debug develop businessintellig javascript associ
Bangalore/Bengaluru(Electronics City Phase 1),softwareengineerwindowsvcmfcc c c vc mfc communicationskil net gdi associ
Bangalore/Bengaluru,softwareengin jqueri program manag softwar program healthcar data datavisu associ
Bangalore/Bengaluru,csoftwareengin c softwar bank associ
Bangalore/Bengaluru,softwareengin microservic springboot java softwar spring softwareengin algorithm datastructur associ
Hybrid - Bangalore/Bengaluru,staffsoftwareengineerjavascripttypescript javascript j2ee architectur java angular typescript develop java midsenior
"Bangalore/ Bengaluru, Karnataka",lookingforasoftwareengineerusmncbangalor c aspnet angular sqlserver javascript cs sql softwar associ
"Bangalore/ Bengaluru, Karnataka",softwareengin ajax javascript angularframework hybridmobileapplicationdevelop mobiledevelop hybridmobil develop framework associ
"Kochi/ Cochin, Kerala",executiveitsoftwareengin angular oracl softwareengin develop softwar jqueri mobileappl applic associ
Hyderabad/Secunderabad,softwareengin invest medic softwareengin process manag riskmanag dataanalysi dataprocess associ
Chennai,softwareengineerhthd continuousintegr javascript softwaredesign git teambuild sql team design associ
Mumbai,softwareengin java microservic engin bootstrap angular spring server boot associ
Gurgaon/Gurugram,softwareengineerroutingswitchingccbngbgp c isi evpn linux c switch softwareengin vpl midsenior
Chennai,softwareengin demandplan systemanalysi manag softwar capacityplan capac architectur technicalarchitectur associ
Chennai,softwareengin unix softwaredevelopmentlifecycl analyt financialservic softwar unixshellscript develop lifecycl associ
Chennai,softwareengin javascript shellscript softwaretest sql script linux softwar aix associ
Mumbai,softwareengin webtechnolog wpf applicationmonitor sql softwareengin sqlserver c monitor associ
Mumbai,softwareengin springframework java hibern spring ibati webservic mybati oracl associ
"Noida, Uttar Pradesh, Gurgaon/ Gurugram, Haryana, Delhi / NCR",softwareengineeranddevelop unixshellscript java softwar shellscript python sql softwareengin mongodb entri
"Hybrid - Hyderabad/Secunderabad, Bangalore/Bengaluru, Delhi / NCR",hiringsoftwareengineersfresherexperiencedboth softwaredevelop hadoop html softwar fullstack applicationprogram develop javascript associ
"Mumbai, Nagpur, Thane, Nasik/Nashik, Pune, Aurangabad",softwareengin code sailpoint architectur productionsupport nosql businessservic continuousimprov applic midsenior
Pune,softwareengin softwareengin netcor softwaredevelop develop sql angular javascript softwar associ
Chennai,softwareengineerc c productdesign program serversid com microsoftwindow sdk ipc associ
"Chennai, Chennai",softwareengin oraclesql develop javadevelop sql softwar oracl java softwareengin associ
Pune,softwareengin git leveldesign instrument issu softwaretest sql instrument case associ
Pune,softwareengin develop architectur agil softwar python softwareengin softwarearchitectur agiledevelop entri
Hybrid - Mumbai (All Areas),softwareengineernetmumbai net api sql webapi softwar webtechnolog softwareengin associ
"Mumbai, Pune",softwareengin enterpris front digitalmarket lifesci softwareengin media enterpriseappl monitor midsenior
New Delhi,softwareengineeradasdomain designdevelop code develop dn program c ada automot associ
"Dharwad, Hubli",softwareengin softwareengin design designdevelop program softwar webtechnolog develop program associ
"Hybrid - Pune, Maharashtra, Gurgaon/ Gurugram, Haryana",softwareengin java springboot microservic angularj datastructur databasedesign j2ee serverlessarchitectur midsenior
Chennai,softwareengin softwaredevelopmentlifecycl manag financialservic softwar oop object develop lifecycl midsenior
Chennai,softwareengin lifecycl softwareengin userexperiencedesign mysql develop ux softwaredevelop design midsenior
Chennai,softwareengin unittest softwar control versioncontrol c geometri civil civilengin associ
"Vadodara/ Baroda, Gujarat",softwareengineernetangular netmvc angular net mvc softwar softwareengin associ
Hyderabad/Secunderabad,softwareengin lifecycl technic agil softwareengin technicaldocument document sql develop associ
Chennai,softwareengin technolog contractmanufactur project troubleshoot interperson manag softwareengin interpersonalskil entri
Jaipur,softwareengineerjavascript develop packag object frontend javascript webtechnolog ui front associ
Delhi / NCR,softwareengin javascript node mernstack mean stack angular reactj softwar associ
Hyderabad/Secunderabad,softwareengin train applic projectexecut code project applicationtest execut softwareengin midsenior
"Hybrid - Pune, Maharashtra",softwareengin python java softwareengin spring springboot boot j2ee softwar associ
Pune,softwareengin linux healthcar git end analyt code softwareengin front associ
Hybrid - Chennai,softwareengineerplsqlunixchennai unix plsql softwar softwareengin associ
"Vadodara/ Baroda, Gujarat",hiringsoftwareengineersnetcoreandangularskillsforvadodara html angular core sql javascript aspnet dot hire associ
Dubai,opportunityassoftwareengineerwithleadingcompanyatdubai sdkintegr cctvdomainswdevelop accesscontrol develop access accesscontrolsystem cicd s midsenior
"Mumbai, Hyderabad/Secunderabad",softwareengineercaspnet c jqueri serv softwar api designpattern aspnet mvc associ
"Pune, Maharashtra, Vadodara/ Baroda, Gujarat",softwareengin aspnet angular net aspnetmvc softwar api aspnetwebapi mvc midsenior
Chennai,softwareengin java springboot microservic boot spring softwareengin softwar midsenior
"Kolkata, Mumbai, New Delhi, Hyderabad/Secunderabad, Pune, Chennai, Bangalore/Bengaluru",softwareengin analyt secur data machin datasecur sql machinelearn hbase entri
Bangalore/Bengaluru,hiringforaseniorsoftwareengineersalaryupto15lpadayshift c xamarin aspnetcor maui dotnetcor aspnet xamarinform dot midsenior
Bangalore/Bengaluru,softwareengin manag analyt softwar agil linux c javascript softwareengin associ
Bangalore/Bengaluru,softwareengin system salesforc sap continuousimprov audit softwar designreview improv entri
Bangalore/Bengaluru,softwareengineerwci frontend architectur javascript technolog front end wip softwar midsenior
Bangalore/Bengaluru,autosarsoftwareengin ud embeddedc diagnost c git autosar tool manag associ
"Hyderabad/Secunderabad, Chennai, Bangalore/Bengaluru",softwareengineerflexplmlululemon softwar flexplm softwareengin flexplm midsenior
Bangalore/Bengaluru,softwareengineertelematicscv2x c linux embeddedc telemat v2x gp embeddedsystem aspic midsenior
Bangalore/Bengaluru,softwareengin perform python infrastructuremanag monitor configur qualitymanag performancetest troubleshoot associ
Bangalore/Bengaluru,softwareengin develop sql datastructur softwar applic analyt media design associ
Bangalore/Bengaluru,softwareengineerlim powerbivisu scriptinglanguag datalak queri factori azuredatafactori crystal serv associ
Bangalore/Bengaluru,softwareengin framework tool angular docker agil sonar nativ engin associ
Bangalore/Bengaluru,softwareengin softwaredevelop softwar cloudappl cd nativ awslambda golang cosmo midsenior
"Bangalore/ Bengaluru, Karnataka",softwareengin reactj net softwar javascript softwareengin c webservic webtechnolog associ
"Hybrid - Pune(Kothrud), Bangalore/Bengaluru(Bellandur +1)",softwareengineerwifikernel linux wlan wifi 80211 accesspoint access wirelesslan develop midsenior
Bangalore/Bengaluru,softwareengin boot bootstrap spring javascript end data code softwareengin associ
"Hybrid - Pune, Maharashtra, Coimbatore, Tamil Nadu, Bangalore/Bengaluru",softwareengin embeddedc microcontrol devicedriverdevelop autosar verificationandvalid verif function iso associ
Bangalore/Bengaluru,softwareengin warehous analysi workflow sql informatica data softwareengin dataanalysi associ
Bangalore/Bengaluru,softwareengineeratlassian shellscript ssl atlassian servicemanag unix script linux ldap associ
Bangalore/Bengaluru,softwareengin businessprocess changemanag jira process chang data code microsoft associ
Bangalore/Bengaluru,softwareengin c softwareengin virtual developmenttest softwaredesign design wireshark debug associ
Bangalore/Bengaluru,csoftwareengin teambuild c sdk autom script softwar team android associ
Bangalore/Bengaluru,softwareengin scrum develop rrc designdevelop design pdcp softwareengin developmenttest entri
Bangalore/Bengaluru,softwareengin linq softwar technologysolut technolog json javascript jqueri code entri
Hyderabad/Secunderabad,softwareengin softwareengin terraform autom cd boot ip mysql sql midsenior
Bangalore/Bengaluru,softwareengin autom sqa versioncontrol git webtechnolog debug agil jenkin midsenior
"Hybrid - Bangalore/ Bengaluru, Karnataka, Vadodara/ Baroda, Gujarat",softwareengineervbnetvb6 reacti net vb6 vb softwar softwareengin midsenior
Bangalore/Bengaluru,softwareengin pdf jqueri linq softwar javascript xml code json entri
Remote,golangawssoftwareengineersforausmnc golang datastructur aw sql microservic softwar design data midsenior
"Pune, Bangalore/Bengaluru",softwareengineernxcustom nxcustom open vb c apiautom softwareengin openapi assembl associ
"Chennai, Bangalore/Bengaluru",softwareengin itservic san code crm python snmp mpl softwar associ
Bangalore/Bengaluru,softwareengineerjavascriptcssnet css cs frontend datastructur javascript softwar objectivec engin midsenior
"Bangalore/Bengaluru, Delhi / NCR",softwareengineernetc c sql sqlserver serv webapi softwar paa microsoftazur associ
"Hybrid - New Delhi, Pune, Mumbai (All Areas)",softwareengin softwaretest electron softwar computerskil comput basic webappl fullstack associ
Bangalore/Bengaluru,urgentopeningforsoftwareengin 5 g c ran develop softwaredevelop pdcp softwar mac associ
"Kolkata, Mumbai, New Delhi, Hyderabad/Secunderabad, Pune, Chennai, Bangalore/Bengaluru",softwareengin mvcframework develop webservic intellijidea designdevelop github design sql midsenior
"Kolkata, Mumbai, New Delhi, Hyderabad/Secunderabad, Pune, Chennai, Bangalore/Bengaluru",softwareengin object code xml datastructur perl data softwareengin program entri
"Kolkata, Mumbai, New Delhi, Hyderabad/Secunderabad, Pune, Chennai, Bangalore/Bengaluru",softwareengin mysql bigdata sdlc hadoop data sql oracl testcas entri
"Kolkata, Mumbai, New Delhi, Hyderabad/Secunderabad, Pune, Chennai, Bangalore/Bengaluru",softwareengin softwareengin excel softwar save entri
"Kolkata, Mumbai, New Delhi, Hyderabad/Secunderabad, Pune, Chennai, Bangalore/Bengaluru",softwareengin wordprocess spreadsheet softwar process socialmedia dbm video code entri
