Location,Tags
"Kochi/ Cochin, Kerala, Chennai, Tamil Nadu, Bangalore/Bengaluru",jobopportunitydatascientistchennaibangalorekochi awssagemak data machin machinelearn python sql aw midsenior
"Chennai, Bangalore/Bengaluru",associatedatascientist python analyt data sql dataanalyt scienc powerbi spotfir associ
"Chennai, Bangalore/Bengaluru",datascienceteamlead datasci intellig machinelearn scienc data deeplearn artificialintellig machin senior
Bangalore/Bengaluru,datasciencemanagermachinelearningpredictivemodel datasci neuralnetwork develop productdevelop data network machin machinelearn midsenior
Bangalore/Bengaluru,seniordatascientist datamodel data sql intellectualproperti scienc webtechnolog analyt senior associ
Bangalore/Bengaluru,seniordatascientistazureml azur network bayesian git azuredevop cicd azuremachinelearn python midsenior
Bangalore/Bengaluru,airesearchermodel artificialintellig microsoft bayesian pytorch microsoftazur deeplearn research intellig associ
Bangalore/Bengaluru,seniorstaffaianddatascienceresearcherteamlead teamlead licens data artificialintellig process imageprocess game scienc midsenior
Bangalore/Bengaluru,srdatascientist datamin sr process datamanag sql analysi data manag midsenior
Bangalore/Bengaluru,datascientist analysi trendanalysi data trend financ predictivemodel quantitativeanalysi research associ
Bangalore/Bengaluru,nlpdatascientist improv perform develop agil healthcar tdd data open associ
Bangalore/Bengaluru,principaldatascientist python qualiti machinelearn dataanalysi analysi analyt prototyp data midsenior
Bangalore/Bengaluru,leaddatascientistdiversityrol python data machin sql machinelearn scienc datasci midsenior
Bangalore/Bengaluru,researchscientistmachinelearningdevelopmentjavacpythonr java predictivemodel perl c datamin learningmanag datamodel datamanag midsenior
Bangalore/Bengaluru,seniormanageroperationsresearchscientistmachinelearningalgorithm machinelearn manag algorithm senior research operationsresearch operationsmanag r midsenior
Bangalore/Bengaluru,researchscientistmachinelearningartificialintellig machinelearn machin python process artificialintellig data java signalprocess associ
"Chennai, Bangalore/Bengaluru",seniordatascientistteammanagerstatisticalmodelingrpython python senior statisticalmodel r datasci datamanag sql data midsenior
Bangalore/Bengaluru,researchscientistnlpmachinelearn machinelearn datasci model research data machin scienc naturallanguageprocess midsenior
Bangalore/Bengaluru,researchscientistmachinelearningdevelop machinelearn java c r data machin python research midsenior
Bangalore/Bengaluru,seniormanageroperationresearchscientistmachinelearningalgorithm machinelearn manag groovi matlab datamodel sql model python midsenior
Bangalore/Bengaluru,speechscientistartificialintelligencemachinelearn machinelearn vision speech datastructur intellig biometr process computervis associ
Bangalore/Bengaluru,seniordatascientistoilgasmanufacturingindustri datasci ga intellig machin data artificialintellig oil rootcaus senior
"Hybrid - Chennai, Tamil Nadu, Bangalore/Bengaluru",datascientist logisticregress machinelearn fraudanalyt financialanalyt python statist logist model associ
"Chennai, Bangalore/Bengaluru",datascientist python intellig machin artificialintellig aiml bigqueri azuremachinelearn gcp associ
"Chennai, Bangalore/Bengaluru",marketingdatascientist analyt market oper machin data sql machinelearn operationsresearch entri
Bangalore/Bengaluru,datascientistseniordatascientist excel python sql senior r data associ
Remote,datascientist datasci python datamin machinelearn artificialintellig intellig machin scienc associ
"Gurgaon/ Gurugram, Haryana, Delhi / NCR",jobhiringforseniordatascientistsexpertgurgaon timeseri machinelearn hire machin process time senior data associ
Remote,hiringfordatascientist datasci python hadoop machinelearn deeplearn hire data machin midsenior
Bangalore/Bengaluru,datascientist python git machinelearn aw analysi deeplearn datamin datavisu associ
Bangalore/Bengaluru,engineerdatasciencedatascienceengin intellig datasci comput machinelearn computervis analyt code data entri
Kolhapur,datascientist research datamin program oper computersci machin applic program entri
"Mumbai, Maharashtra, Pune, Maharashtra, Chennai, Tamil Nadu",datascientist tensorflow nlp kera process pytorch awssagemak data rnn senior
"Hybrid - Pune, Maharashtra, Mumbai (All Areas)",datascientist datascientist azuredatabrick deeplearn data machin machinelearn azuresynaps azuremachinelearn midsenior
"Noida, Bhubaneswar, Pune, Bangalore/Bengaluru",leaddatascientistmarketingandcustomeranalyt acquisit opensourc customeranalyt dataanalyt sql tool market data midsenior
"Pune, Maharashtra, Bangalore/ Bengaluru, Karnataka",datascientistnlp nltk model spaci analys data naturallanguageprocess word fasttext midsenior
Remote,datascientist bigdatatechnologiessuchashadoop cloudcomputingplatform nosql comput aw tableau tool machin associ
"Hybrid - Pune, Maharashtra",hiringdatascientistmtechphdproductmnckharadipun naturallanguageprocess analysi languag process deeplearn sentimentanalysi data process senior
"Hybrid - Pune, Maharashtra",hiringdatascientistmtechphdproductmnckharadipun naturallanguageprocess process analysi data deeplearn hire sentimentanalysi languag senior
Pune,softwareengineerdatascientist signal predictivemodel softwar languag python datasci comput model associ
Mumbai (All Areas),seniordatascientist datasci naturallanguageprocess machinelearningalgorithm python vision deeplearn network docker associ
"Varanasi/Benaras, Cannanore/Kannur, Mumbai, New Delhi",datascientist datavisu powerbi bi statisticalmodel tableau analyt analyt data entri
"Navi Mumbai, Maharashtra",hiringfordatascientist panda python numpi datasci data scienc hire midsenior
Mumbai,chiefdatasciencerolebank datascientist statist datasci datamanag datamodel bigdata model scienc execut
Mumbai,datascientist datascientist entri
Mumbai,juniorsoftwareengineerdatasci sql manag machinelearn cloudcomput python data scienc machin entri
"Chennai, Bangalore/Bengaluru",datascientistbusinessintellig java flutter androidstudio android kotlin cloud intellig businessintellig associ
Bangalore/Bengaluru,datascienceaimlprofession cloud cloudcomput datasci simul businesssolut comput ml machinelearn midsenior
Bangalore/Bengaluru,datascienceaimlprofession ml mysql sdlc jira datasci cloudcomput analysi sql senior
Bangalore/Bengaluru,datascientistii hypothesi datasci dataanalyt machinelearn subject scienc data program associ
Bangalore/Bengaluru,principalengin linux teambuild suppli lifesci machinelearn scienc supplychain machin midsenior
Bangalore/Bengaluru,datascientist analysi dataanalysi linux monitor data datamin process collect associ
Bangalore/Bengaluru,datascientist machin predict python predictivemodel monitor data datamin machinelearn associ
Bangalore/Bengaluru,seniormanagerresearchscientistmachinelearn machinelearn manag java datamodel c r data machin senior
Bangalore/Bengaluru,seniordatascientist document documentreview customerretent machin process sql review senior associ
Bangalore/Bengaluru,datascienceaiml cloud analysi businesssolut datasci simul dataanalysi data machin associ
"Gurgaon/Gurugram, Bangalore/Bengaluru",datascientist dbm datavisu manag databasemanag data datastructur gcp perl senior
Bangalore/Bengaluru,datascienceaimlprofession analysi artificialintellig dataanalysi data machin sql machinelearn ml associ
Bangalore/Bengaluru,datascienceaiml analysi artificialintellig dataanalysi data machin sql aiml ml midsenior
Bangalore/Bengaluru,seniormanageroperationsresearchscientistmachinelearn machinelearn machin matlab groovi sql manag algorithm seniormanag midsenior
Bangalore/Bengaluru,seniormanageroperationsresearchscientistmachinelearn machinelearn gurobi seniormanag matlab oper sql clojur algorithm midsenior
Bangalore/Bengaluru,seniorleaddatascientist computervis forecast machin cloudservic leadership senior analyt vision midsenior
Bangalore/Bengaluru,seniordatascientist report regress mysql senior dataanalysi datareport analyt data midsenior
Remote,datascientist python googleanalyt nosql queri tableau analyt sql data midsenior
Bangalore/Bengaluru,speechscientistartificialintelligencemachinelearn machinelearn comput naturallanguageprocess algorithm biometr speech machin speechrecognit associ
Bangalore/Bengaluru,seniormanagerresearchscientistmachinelearn machinelearn java manag c rubi machin groovi python senior
Bangalore/Bengaluru,datascientist analyt googleanalyt data machin sql machinelearn googl object senior
Hybrid - Bangalore/Bengaluru,datascientist datasci python data aw machin sql machinelearn scienc midsenior
Bangalore/Bengaluru,seniordatascientistdlnlpchubbbangalor nlp transform bert deeplearn cnn naturallanguageprocess data senior midsenior
Chennai,leaddatascientist analysi c matlab data sql machinelearn sa spss associ
Bangalore/Bengaluru,datascientist machin predict python predictivemodel datamin datamanag machinelearn troubleshoot associ
"Noida, Gurgaon/Gurugram, Delhi / NCR",principaldatascientistsrdatascientistdatascientistnlp machinelearn analysi sr naturallanguageprocess datasci datamodel deeplearn numpi associ
"Noida, Gurgaon/Gurugram, Delhi / NCR",principaldatascientistseniordatascientistdatascientistnlpml machinelearn naturallanguageprocess datasci datamodel deeplearn numpi data machin associ
"Hyderabad/Secunderabad, Bangalore/Bengaluru",nlpdatascientist naturallanguageprocess data control dataanalysi gcp program basic technologysolut associ
"Hyderabad/Secunderabad, Bangalore/Bengaluru",datascientist analysi sql python analyt control gcp datasci git associ
"Hyderabad/Secunderabad, Bangalore/Bengaluru",datascientistsrdatascientist comput data program computersci deeplearn regress machin sr associ
"Hyderabad/Secunderabad, Bangalore/Bengaluru",leaddatascientist linux leadership python logist comput unix customerservic machinelearn midsenior
Hyderabad/Secunderabad,datascientist analyt analyt develop dataqu data system architectur machinelearn midsenior
Hyderabad/Secunderabad,datascientisthyderabadworkfromoffic python datascientist machinelearn offic data machin midsenior
Hyderabad/Secunderabad,datascientist deploy datacollect bigdata deeplearn devop data datasci cloud associ
Hyderabad/Secunderabad,datascientist vendormanag accesscontrol customerrelationship data vendor helpdesk asset access associ
"Mumbai, Nagpur, Thane, Nasik/Nashik, Pune, Aurangabad",datascientist softwaretest python queri machin script data matlab scienc associ
"Pune, Maharashtra",datascientist spark languag naturallanguageprocess datasci process data python process associ
"Pune, Maharashtra",seniordatascientist spark naturallanguageprocess python scienc process datasci hive senior midsenior
"Pune, Balewadi",seniordatascientistonsit datasci codedevelop numpi dataanalyt senior github scienc panda associ
Pune,seniordatascientist senior develop german dataanalyt jira datasci acquisit analyt associ
Pune,datascientist python data machinelearn program program datavisu machin associ
Pune,seniordatascientistmachinelearningpredictivemodel machinelearn algorithm datasci r tool data dataintegrationtool datavisu senior
"Hybrid - Pune, Maharashtra",urgentopeningfordatascientist naturallanguageprocess process sentimentanalysi analysi data languag deeplearn process senior
Pune,jraimldevelop comput manag dataqu vision develop computervis analysi revenu entri
Pune,mldatascientist pdf analysi machin model analyt datastructur data scienc entri
Pune,datascientistjrsr datamin consult machinelearn autom businessoper oper aerospac data entri
Pune,jraimldevelop revenu dataanalysi healthcar dataqu comput revenuecyclemanag machin datavisu entri
Pune,interndatascientist sql manag machinelearn python data troubleshoot datamin machin entri
Mumbai,seniordatascientist quantit datamin research senior actuari riskmanag quantitativeresearch analyt midsenior
Mumbai,seniordatascientist actuari python datamin quantit claim senior dataanalysi risk midsenior
"Mumbai, Maharashtra, Mumbai Suburban, Maharashtra, Mumbai (All Areas)",datascientist datasci python naturallanguageprocess datamodel machinelearn analyt code deeplearn midsenior
Remote,jobopeningdatascientistmumbai datascientist dataengin python datasci data scienc engin midsenior
Temp. WFH - Mumbai (All Areas)(Mindspace),datascientist python datamin machinelearn artificialintellig analysi dataanalysi r data associ
Remote,datascientistseniordatascientist deeplearn algorithm machinelearn senior data python machin midsenior
"Mumbai, Aurangabad",seniordatascientist forecast develop datascientist analysi reinforc comput bag machinelearn midsenior
"Delhi / NCR, Mumbai (All Areas)",datascientistanalyticsspecialist naturallanguageprocess machinelearn python sql statisticalmodel process logist predictiveanalyt associ
Bangalore/Bengaluru(Marathahalli),srdatascientistsimul python simulink pythonwithazurecloudawscloud matlab sr datamodel simulationsoftwar data midsenior
Bangalore/Bengaluru,datascientist python datasci data spark usag program scienc program midsenior
Bangalore/Bengaluru,seniordatascientist technolog senior statist manag technologymanag analysi time process midsenior
Bangalore/Bengaluru,datascientist data operationsresearch autom artificialintellig sassql sql machinelearn computersci midsenior
"Chennai, Bangalore/Bengaluru",seniordatascientist data python hive hadoop datacollect senior scienc bigdata midsenior
"Hubli, Mangaluru/Mangalore, Mysore/Mysuru, Bangalore/Bengaluru, Belagavi/Belgaum",srdatascientist genet cloudcomput comput customeranalyt datamin cloud code stakeholdermanag associ
Bangalore/Bengaluru,seniordatascientistsciph agil genet machin analyt machinelearn energi analyt data senior
Bangalore/Bengaluru,datascientist regress analyt mysql matlab data report dataanalysi analysi midsenior
Bangalore/Bengaluru,datascientist deeplearn sql python manag supervis chang project projectmanag associ
Bangalore/Bengaluru,datascientistiii process python analyt analyt network healthcar languag machin midsenior
"Gurgaon/ Gurugram, Haryana, Bangalore/ Bengaluru, Karnataka, Delhi / NCR",leaddatascientist dataengin sasprogram bigdata hive spark databaseadministr pyspark manag senior
Bangalore/Bengaluru,datascientist digitaltransform datamodel strategyconsult consult digit project data transform associ
Bangalore/Bengaluru,datascientist analyt itservic operationsresearch data plan research crm product associ
Bangalore/Bengaluru,datascientist data cnn tensorflow pytorch naturallanguageprocess nlp datascientist structureddata midsenior
Bangalore/Bengaluru,datascientist data machinelearn scienc bigdata machin datasci associ
Bangalore/Bengaluru,datascientistii opensourc open analysi machin analyt datastructur computersci data associ
Remote,datascientistseniordatascientist datasci recommendersystem sql python senior data scienc system associ
Bangalore/Bengaluru,datascientist datasci python r datamin dataextract predictivemodel statist logist senior
Bangalore/Bengaluru,datascientist signal datamin productmanag data datavisu postgresql mysql analyt associ
Bangalore/Bengaluru,graduatedatascientist systemprogram model predict develop predictivemodel datasci distributionsystem technologymanag associ
Bangalore/Bengaluru,speechscientistartificialintelligencemachinelearn artificialintellig intellig speechrecognit algorithm data vision speech comput associ
Bangalore/Bengaluru,deeplearningseniorengineerpssip technologymanag datavisu sip manag develop process imageprocess opencv associ
Bangalore/Bengaluru,researchscientist languag dataprocess naturallanguageprocess process socialmedia applicationdevelop data machin associ
Bangalore/Bengaluru,leaddatascientist suppli machin manag productmanag crm scienc supplychain analyt midsenior
Remote,datascientist3yearsofexperi predictivemodel forecast predict linearregress data regress model logist associ
Remote,datascientist r machinelearn xgboost python data machin associ
Bangalore/Bengaluru,imageanalysisscientistimageprocessingpatternrecognit imageprocess architectur designpattern c c technic patternrecognit process midsenior
Bangalore/Bengaluru,seniorscientistnlpmachinelearningdataminingprofession datascientist datamin naturallanguageprocess senior linux r datamanag sql associ
Bangalore/Bengaluru,machinelearningscientistrpython python java r data machin machinelearn matlab datamin midsenior
Bangalore/Bengaluru,datascientistii analyt metadata analyt data linux dataanalysi datastructur game associ
Hybrid - Bangalore/Bengaluru,seniordatascientist datasci statisticalmodel machin python pytorch scienc machinelearn tensorflow midsenior
Bangalore/Bengaluru,datascientist python naturallanguageprocess numpi data datavisu datamin scipi tensorflow associ
Bangalore/Bengaluru,seniordatascientist acquisit forecast datacollect manag dataextract sql productmanag scienc associ
Hybrid - Bangalore/Bengaluru,datascientist datasci python r machinelearningalgorithm sql machin scienc machinelearn midsenior
Bangalore/Bengaluru,seniordatascientist research senior sql process operationsresearch python data machinelearn entri
Bangalore/Bengaluru,principaldatascientistimmediatejoinerpremiuminstituteonli datasci artificialintellig data machin machinelearn naturallanguageprocess scienc intellig midsenior
"Bangalore/Bengaluru, HSR Layout",datascientist pythoncod sql logisticregress scienc regress code r decisiontre associ
"Hubli, Mangaluru/Mangalore, Mysore/Mysuru, Bangalore/Bengaluru, Belagavi/Belgaum",techleaddatascientist clinicaltri drug datasci technicalanalysi lifesci comput machinelearn drugsafeti midsenior
Bangalore/Bengaluru,datascientist corebank teammanag riskmanag core productmanag mi businessanalysi changemanag execut
Hybrid - Bangalore/Bengaluru,datascientistl naturallanguageprocess machin process machinelearn data process languag associ
Bangalore/Bengaluru,seniordatascientistnlgenerationanalyt nlp nlg dataanalyt machin process scienc senior analyt midsenior
Bangalore/Bengaluru,researchscientistmachinelearningartificialintellig datasci machin python scienc c process data artificialintellig associ
Bangalore/Bengaluru,leaddatascientistpythonmachinelearn machinelearn python cloud predictivemodel statist model predict data midsenior
"Hybrid - Bangalore/ Bengaluru, Karnataka",leaddatascientist datasci data softwar scienc statisticalsoftwar statist statisticalmodel shini midsenior
Bangalore/Bengaluru,datascientist c analyt dataanalysi datareport matlab scienc comput data midsenior
Bangalore/Bengaluru,seniordatascientistpay analysi datasci dataanalysi data businessanalysi python sql senior associ
Bangalore/Bengaluru,nlpdatascientist c naturallanguageprocess integr design javascript mysql technicalproductconfigur configur associ
Bangalore/Bengaluru,seniordatascientist datasci time process dataanalysi logist machinelearn timeseri statist associ
Bangalore/Bengaluru,datascientistmlb regress data vendor develop forecast sa itservic python associ
Bangalore/Bengaluru,leaddatascientist machin python scienc comput capac teradata scala machinelearn midsenior
"Chennai, Bangalore/Bengaluru",datascientist comput python computervis network supervis neuralnetwork process data associ
Bangalore/Bengaluru,datascientistwebanalyt model datamodel analyt code ecommerc data hrsd webanalyt senior
Bangalore/Bengaluru,datascientistpredictivemodel data predictivemodel predict hrsd code ecommerc datamodel model senior
Bangalore/Bengaluru,datascientistmachinelearn ecommerc machin model data hrsd machinelearn html datamodel senior
Bangalore/Bengaluru,datascientistaimlteam artificialintellig machin data ml collect monitor team sql senior
Bangalore/Bengaluru,seniormanagerquantumcomput quantum process cloudcomput processimprov quantumcomput improv machinelearn projectdeliveri senior
Bangalore/Bengaluru,datascientist datamanag forecast dataanalyt sql machinelearn qlikview python data midsenior
Bangalore/Bengaluru,seniorgeospatialdatascientist gi senior industri remot data open imageprocess analyt associ
Bangalore/Bengaluru,imageprocessingengin datastructur process data scienc computervis imageprocess agil python associ
Bangalore/Bengaluru,datascientist model python data comput analysi agil scrum cloudcomput associ
Bangalore/Bengaluru,computervisionengin applicationdevelop comput comput cloudcomput process vision c imageprocess associ
Bangalore/Bengaluru,datascientist analyt continuousimprov data machin machinelearn nosql pdf system midsenior
"Hybrid - Gurgaon/ Gurugram, Haryana",srdatascientist datasci naturallanguageprocess machinelearn deeplearn machin process scienc sr associ
Bangalore/Bengaluru,aidatascientist recruit intellig analyt artificialintellig data staf consult associ
Bangalore/Bengaluru,datascientist datamodel data datasci base excel sql sa scienc midsenior
Bangalore/Bengaluru,datascientist analyt financialservic qlikview data machin nosql sql dataanalyt associ
Bangalore/Bengaluru,datascientist advancedanalyt python analyt model customerexperi architectur dbm datasci associ
Bangalore/Bengaluru,senioraidatascientist data senior intellig analyt artificialintellig midsenior
Bangalore/Bengaluru,datascientistsrdatascientist research sensor datacollect sensor dataanalysi data graphic datasci midsenior
Bangalore/Bengaluru,datascientist physic secur dbm manag datawareh sql scienc securitysystem associ
Bangalore/Bengaluru,datascientist predict data computersci agil model datacollect datastructur predictivemodel associ
"New Delhi, Bangalore/Bengaluru",aimlengin designpattern git predictivemodel patternrecognit versioncontrol datamin ml machinelearn associ
Bangalore/Bengaluru,datascientist opensourc forecast textmin machinelearn python improv automot data midsenior
Bangalore/Bengaluru,seniordatascientist comput graphic manag pdf project javascript computersci senior associ
Bangalore/Bengaluru,srdatascientist project staf data timemanag datavisu linux unix bioinformat senior
Bangalore/Bengaluru,datascientisthealthcareanalyt tool data program troubleshoot healthcareanalyt machin sql report senior
"Chennai, Bangalore/Bengaluru",datascientistadvancedanalyticsmachinelearn analyt artificialintellig machin data rprogram program dataanalyt intellig associ
"Vijayawada, Bangalore/Bengaluru",rprogramm dataanalysi data sql backend scienc datasci rprogram monitor associ
Bangalore/Bengaluru,nlpdatascientist cloud transform analyt conferenc data well video naturallanguageprocess associ
Bangalore/Bengaluru,managerdatasci analyt manag sql forecast intellig scienc data businessintellig associ
Bangalore/Bengaluru,srdatascientist python datasci analyt datastructur machin analyt computersci data midsenior
"Noida, Bangalore/Bengaluru",datascientist comput datamin resourcealloc analyt sa computersci sql improv associ
Bangalore/Bengaluru,seniormlengin python scienc technolog financialservic machinelearn agil comput engin midsenior
Bangalore/Bengaluru,datascientist statist microsoft data machin machinelearn pdf word analysi associ
Bangalore/Bengaluru,datascientisthealthcareanalyt dataanalyt tool report analyt program bigdata sql textanalyt midsenior
Bangalore/Bengaluru,datascientist data datavisu recruit rdbm powerbi bi advancedanalyt intellig associ
Bangalore/Bengaluru,datascientist datamin businessintellig intellig process dataprocess data c businessanalyt midsenior
Bangalore/Bengaluru,seniordatascientist analysi dataanalysi data rubi machin python sql analyt midsenior
Bangalore/Bengaluru,datascientist spark forecast statist datasci tableau machinelearn demandforecast scienc associ
Bangalore/Bengaluru,seniordatascientist advancedanalyt analyt senior machin datasci scienc data operationsresearch associ
Bangalore/Bengaluru,datascientist research machinelearn operationsresearch datasci sql data scienc microsoft associ
Bangalore/Bengaluru,mllead machin analyt process ml languag naturallanguageprocess machinelearn train associ
Bangalore/Bengaluru,datascientist data computersci javascript consult technolog scienc sql informationtechnolog associ
Bangalore/Bengaluru,datascientist research comput datamin c analyt datacollect businessintellig oper associ
Bangalore/Bengaluru,datascientist salesforc datasci python scienc machinelearn computervis datamin vision associ
Bangalore/Bengaluru,rddatascientist opensourc autom timeseriesanalysi monitor machin workflow analysi data associ
Bangalore/Bengaluru,seniordatascientist cyber machin python blackberri properti secur machinelearn cybersecur midsenior
Bangalore/Bengaluru,leadstaffmlscientistnlp program python datasci scienc data languag machinelearn process midsenior
Bangalore/Bengaluru,leadstaffmlscientist research ml process program pop deeplearn naturallanguageprocess languag midsenior
Bangalore/Bengaluru,datascientist opensourc object open microsoft intellig sql sqlserver data midsenior
"Chennai, Bangalore/Bengaluru",datascientist research intellectualproperti qualiti program analyt dataqu analyt spark associ
Bangalore/Bengaluru,principaldatascientist datavisu machinelearn process process datasci drill automot research midsenior
Bangalore/Bengaluru,sde2datascientist python bpo logisticregress logist risk datasci credit creditrisk associ
Bangalore/Bengaluru,sde1datascientist credit machinelearn datasci python data logisticregress personalloan customerservic senior
Bangalore/Bengaluru,dataengin dataengin datacollect deploy bigdata deeplearn devop data datasci midsenior
Bangalore/Bengaluru,srdatascientist analysi comput python linearregress sr healthcar businessintellig presal midsenior
Bangalore/Bengaluru,srdotdatascientist dot crm analyt media socialmedia customeranalyt sql staf midsenior
Bangalore/Bengaluru,srdatascientistmedicalmarketinganalyt healthcar sql market troubleshoot socialmedia marketinganalyt analyt data midsenior
Bangalore/Bengaluru,srdatascientistmarketingandcustomeranalyt dataanalyt tool crm report analyt customeranalyt sql staf senior
