Location,Tags
Hybrid - Noida,engineerdevopsazurecloudcdn cdn azur python webtechnolog webserv azurecloud cloudstack powershel associ
Hybrid - Gurgaon/Gurugram,immediatejoinersazuredevelopergurugram pyspark azuredatafactori devop python develop datalak factori azuredatalak associ
Ahmedabad,azurecloudengin disasterrecov recoveri projectmanag comput autom versioncontrol monitor tool associ
Pune,l3azuredeveloperiaaspaassolut azurecloudplatform operationsmanag powershel system serv systemadministr mysql administr senior
Kolkata,microsoftazureanalyticsservicesapplicationdevelop azureanalyt azurehdinsight scala bigdata dataarchitectur teamlead analyticsservic develop associ
Kolkata,microsoftazureanalyticsservicesapplicationdevelop microsoftazureanalyt scala pyspark bigdata dataarchitectur teamlead analyticsservic develop associ
Kolkata,microsoftazureanalyticsservicesapplicationdevelop analyt dataarchitectur businessprocess analyt scala pyspark develop azureanalysi associ
Kolkata,microsoftazuredataservicesapplicationdevelop performancetun queryoptim datamodel sql dataservic applicationdevelop troubleshoot perform associ
Kolkata,microsoftazuredataservicesapplicationdevelop performancetun datamodel sql perform plsql program dataservic develop associ
"Hyderabad/ Secunderabad, Telangana, Pune, Maharashtra, Chennai, Tamil Nadu, Bangalore/ Bengaluru, Karnataka",hiringforazuresolutionarchitect solutionarchitect azuresolut powershel azuredevop devop hire dbm hyperv execut
"Pune, Maharashtra",azureinfrastructureadmin azureinfrastructur monitor infrastructur azurepaa paa azuremonitor administr microsoftazur midsenior
"Hyderabad/Secunderabad, Pune, Bangalore/Bengaluru",azuredataarchitect architectur perl c agil javascript maven configurationmanag configur senior
"Hyderabad/Secunderabad, Bangalore/Bengaluru, Delhi / NCR",tssrazuresolutionarchitect azur powerbi azuredatabrick datafactori bi sr microsoftazur ts senior
Hybrid - Kolkata,azuredataengin azuredatalak datalak data azuredatafactori microsoftazur associ
"Hybrid - Pune, Chennai, Mumbai (All Areas)",hexawareishiringseniorcloudarchitectazur rfi azurecloud microsoftazur presal rfp hire architectur senior execut
Chennai,azureengin scrum agil german consult businessanalysi analysi systemdesign technolog entri
Ahmedabad,azurecloudspecialist autom linux disasterrecoveri dn healthcar vm verita configur associ
"Kolkata, Mumbai, Hyderabad/Secunderabad, Pune, Chennai, Ahmedabad, Delhi / NCR, Bangalore/Bengaluru",netdeveloperazurecsqlserv c net develop paa mvc sqlserver sqlazur microsoftazur midsenior
Pune,applicationsolutionarchitectazurekubernetesservic azur continuousintegr puppet continuousintegr microservic pipelin cicdpipelin architectur senior
"Noida, Uttar Pradesh, Gurgaon/ Gurugram, Haryana, Delhi / NCR",azurecloudengin virtualnetwork virtualmachin azurecloud azurecloudplatform microsoftazur cloud microsoft network midsenior
Bangalore/Bengaluru,dotnetfullstackazuredevelop agil framework supportservic paa develop project entityframework netfullstack associ
Bangalore/Bengaluru,dataengineerazur datalak spark factori azuredatafactori serv sqlazur brick azureiot associ
"Kolkata, Hyderabad/Secunderabad, Bangalore/Bengaluru",tsazuredataengin dataengin databrick azur snowflak data engin factori sql midsenior
Bangalore/Bengaluru,dataengineerazur dataengin functionaltest develop datamodel azuredatafactori data sql unittest associ
Hybrid - Gurgaon/Gurugram,azuredevopsengin azurekubernet kubernet devop azuredevop terraform microsoftazur azurekubernetesservic midsenior
"Kolkata, Mumbai, Hyderabad/Secunderabad, Bangalore/Bengaluru",azuredataengineerdatalakedatafactori datalak tool powerbi datawareh sqlserver datalak dataintegrationtool data associ
"Kolkata, Mumbai, Hyderabad/Secunderabad, Pune, Chennai, Ahmedabad, Delhi / NCR, Bangalore/Bengaluru",azuredataengineeradfazuresynaps azuredata dataintegr data datalak oracleadf dataengin etl azuredatalak associ
"Hybrid - Noida, Uttar Pradesh, New Delhi, Delhi, Delhi / NCR",urgenthiringforgcpazuredataengineernoida azurecloud bigqueri azurecloudplatform hadoop gcpcloud cloudplatform azuredatafactori data associ
"Mumbai, Pune, Lucknow, Chennai, Bangalore/Bengaluru, Delhi,  Kolkatta,  Goa",azuredataengineerleadarchitect java dataengin accessmanag datawareh access kubernet manag data senior
Remote,azurecloudsolutionsarchitect microsoft cloud financialservic agil cloudappl applicationdevelop azurecloud network senior
Remote,devopsengineerazur devop unix scrum linux javascript code agil autom midsenior
"Hybrid - Noida, Uttar Pradesh, Gurgaon/ Gurugram, Haryana, Delhi / NCR",urgenthiringforazuredataengineerpythonpysparkhivesql pyspark dataengin azurecloud hadoop cloud etl hive script associ
Mumbai,dataengineerawsazur python salesforc datamanag softwareservic cloudsecur machin scala dataengin associ
"Kolkata, Mumbai, Hyderabad/Secunderabad, New Delhi, Pune, Chennai, Coimbatore, Bangalore/Bengaluru",azuredataengin data datagovern advancedanalyt analyt microsoftazur dataprocess sqlqueri dataqu midsenior
Bangalore/Bengaluru,etsazurecloudapplicationarchitect cloudservic azurecloud architectur applicationdevelop cloud cloudapplicationdevelop applic eo senior
Kolkata,netazuredevelopercloudinfrastructur azur netarchitect microservicesarchitectur performancetun perform develop microservic architectur senior
Hybrid - Kolkata,azuredataarchitect azuredataarchitect azuredatafactori architectur microsoftazur data senior
Pune,azuredataarchitect olap scrum sap json changemanag dataarchitectur chang azuredatafactori midsenior
"Hybrid - Kolkata, Hyderabad/Secunderabad, Pune, Ahmedabad, Chennai, Bangalore/Bengaluru, Delhi / NCR, Mumbai (All Areas)",azuredataengin azurecloud azuredataengin azurestorag eventhub azuredatafactori data event hub midsenior
"Kolkata, Mumbai, Hyderabad/Secunderabad, Pune, Chennai, Ahmedabad, Bangalore/Bengaluru, Delhi / NCR",azuredataengineerdatamodelingwareh azur datapipelin datalak datawareh microsoftazur datamodel data machin midsenior
"Hyderabad/ Secunderabad, Telangana",hiringforazuredataengineercontractualtopmnc azuredatabrick pyspark sqldatabas hire data factori sql azuredatafactori midsenior
"Noida, Uttar Pradesh",azuredevopsengin design implement cicdpipelin iac azuredevop deploy aod microsoftazur midsenior
Pune,azurel3engineeractivedirectorypowershel azurel3 rdbm systemadministr l3 ticket paa ticketingtool vpn midsenior
Mumbai,azuredevopsengineercicdpipelin azur terraform continuousintegr azuredevop cicdpipelin itinfrastructur microsoftazur pipelin associ
Bangalore/Bengaluru,azuredataengin azuredatabrick azuredatalak datalak snowflak microsoftazur microsoft data azuredatafactori associ
"Hybrid - Pune, Chennai, Bangalore/Bengaluru, Mumbai (All Areas)",hexawareishiringseniorcloudarchitectazur rfi azurecloud microsoftazur presal rfp senior microsoft cloud execut
"Hybrid - Noida, Chennai, Delhi / NCR",azurecloudadminl3andabov azureactivedirectori azurecloud migrat site rhce directori azuresiterecoveri administr senior
Hyderabad/Secunderabad,azurearchitectiaaspaa azur cloud paa devop linux operatingsystem iaa activedirectori midsenior
Bangalore/Bengaluru,itoperationsengineerazuredata itoper performancetest plan terraform cd directori capacityplan cd midsenior
"Pune, Maharashtra, Ahmedabad, Bangalore/Bengaluru",srleadcloudazureengin azureservic c devopstool devop tool azurelogicapp terraform applic associ
Bangalore/Bengaluru,seniorhybridcloudmigrationengineerforazur improv migrat develop senior processimprov applicationdevelop networkengin troubleshoot associ
Hybrid - Pune,netazuredevelop net devop server develop netcor github sql core midsenior
Pune,azuredatafactorydevelop azuredatafactori pyspark powerbi ssa bi develop factori databrick associ
Gurgaon/Gurugram,hiringazureadminwithmin3yrsexp exp hire administr microsoftazur azureadmin associ
"Kolkata, Mumbai, Hyderabad/Secunderabad, Pune, Chennai, Ahmedabad, Bangalore/Bengaluru, Delhi / NCR",dataarchitectadfandazuresynaps adf analyt dashboard azuredatafactori domo dataarchitectur microsoft nosql midsenior
"Hybrid - Nagpur, Maharashtra, Pune, Maharashtra, Chennai, Tamil Nadu",azurearchitect microsoftazur architectur snowflak microsoft senior
Remote,azureenterprisearchitect consult webservic togaf vb sql enterprisearchitectur enterpris microsoftazur midsenior
Remote,azureenterprisearchitect webservic togaf vb sql enterprisearchitectur enterpris microsoftazur architectur midsenior
"Hyderabad/Secunderabad, Bangalore/Bengaluru",microsoftazureadministratorshellscriptingpowershel microsoftazur windowso shellscript powershel sql script linux operatingsystem midsenior
Pune,devopsengineerazurecloud cloud network cost inspect unix networkadministr administr azurecloud associ
Pune,devopsengineerazurecloud inspect networkadministr network unix azurecloud paa administr cost associ
Hyderabad/Secunderabad,microsoftazurepaasapplicationdevelop azur webapi wcf framework sql paa develop softwaredevelop associ
"Kolkata, Mumbai, Hyderabad/Secunderabad, Pune, Chennai, Coimbatore, Bangalore/Bengaluru, Delhi / NCR",azurekubernetesarchitect powershel appservic eventmanag devop appsupport event manag kubernet senior
"Noida, Kolkata, Mumbai, Hyderabad/Secunderabad, Pune, Chennai, Ahmedabad, Coimbatore, Bangalore/Bengaluru",azuredataarchitectassociatedirector azur continuousintegr azurehdinsight direct azuredatabrick spark govern data senior
Mumbai (All Areas)(Powai),dataarchitectazuredatafactoryetlpowerbisaphanaismust dataextract azuredatafactori dataarchitectur saphana etl azuredevop ecc azuredatalak midsenior
Pune,azurearchitectsolutionimplement azur system devop integr itsm ticket ticketingtool cloudintegr midsenior
Pune,azureadministr azur productionsupport cloudintegr powershel secur product system applic midsenior
Bangalore/Bengaluru,solutionsarchitectazur engin sourc linux projectmanag datasecur uml project data senior
Bangalore/Bengaluru,azureadconsult troubleshoot df azuread activedirectori advertis cloud adf microsoft associ
"Hybrid - Hyderabad/Secunderabad, Pune, Chennai, Bangalore/Bengaluru, Mumbai (All Areas)",azureadconsult azureactivedirectori adserv activedirectori directori consult connect adf microsoftazur midsenior
"Mumbai, Bangalore/Bengaluru",azurearchitect azurecli azuresolut vpn dn sql cloud cloudarchitectur cli senior
Hyderabad/Secunderabad,azuredeveloperazuredataengin pyspark azuredatabrick azureblobstorag sqlazur azuresqldw factori azuredatafactori function associ
Bangalore/Bengaluru,seniorsoftwareengineerdevopsazur devop python develop paa jenkin configurationmanag autom performancetun midsenior
"Pune, Ahmedabad, Bangalore/Bengaluru",azuredevopsengin jenkin azuredevop kubernet api iot shellscript apigateway powershel associ
Bangalore/Bengaluru,seniordataengineerazureadfdatalak adf serverlessarchitectur azuredatafactori cosmo function spark architectur db midsenior
Bengaluru,associatedataengineerazureadfdatalak dataengin cosmo engin azuredatalak azuredatafactori aw sql databrick associ
Bangalore/Bengaluru,dataengineerazureadfdatalak dataengin pyspark sql datastructur scala datalak oracleadf sqlazur midsenior
Bangalore/Bengaluru,azuredataplatformsitereliabilityengineerxebiabangalor sitereliabilityengin site reliabilityengin reliabl microsoftazur sre data communicationskil midsenior
Hybrid - Bangalore/Bengaluru,azuredataengineerimmediatejoinersbangalor azuredatafactori adlsgen2 pyspark azuredatabrick sql warehous data azuredatalak associ
Bangalore/Bengaluru,devopsengineerazur devop applic develop sdlc healthcar analyt agil improv midsenior
"Hybrid - Gandhinagar, Gujarat, Pune, Maharashtra",azuredevopsengin azuredevop continuousintegr pipelin azurepipelin cd microsoftazur devop continuousintegr midsenior
Chennai,chaosengineerdevopsazur silicon cloud troubleshoot consult testexecut autom softwaretest azuredevop midsenior
Bangalore/Bengaluru,devopsengineerazur sdlc monitor applicationdevelop develop applic continuousimprov improv healthcar associ
Bangalore/Bengaluru,microsoftazuredataservicesapplicationdevelop nosql rdbm microsoftazur middlewar sql dataservic azuredatabrick develop associ
Bangalore/Bengaluru,microsoftazuredataservicesapplicationdevelop nosql rdbm microsoftazur azuredatabrick sql datapipelin azuredatafactori dataservic associ
Bangalore/Bengaluru,microsoftazureanalyticsservicesapplicationdevelop analyt dataarchitectur businessprocess analyt scala azuredatabrick spark pyspark associ
Bangalore/Bengaluru,microsoftazuredataservicesapplicationdevelop azur postgresql azuredatabas microsoft cosmo azuredatalak azuredatafactori applicationdevelop associ
Bangalore/Bengaluru,microsoftazuredataservicesapplicationdevelop azuredatafactori azur adl azuresqldb azuredatabrick microsoft cloudappl paa midsenior
Bangalore/Bengaluru,microsoftazuredataservicesapplicationdevelop powershel azur git paa iaa dataservic develop applic associ
Bangalore/Bengaluru,microsoftazuredataservicesapplicationdevelop git powershel paa iaa azuredevop armtempl factori azuredatafactori midsenior
Bangalore/Bengaluru,microsoftazuremoderndataplatformapplicationdevelop azur datalak datawarehous gapanalysi warehous softwaredesign develop softwaredevelop midsenior
Bangalore/Bengaluru,microsoftazuremoderndataplatformapplicationdevelop analyticalskil testcas datavisu sql softwaretest powerbi develop datawareh associ
Bangalore/Bengaluru,microsoftazuremoderndataplatformapplicationdevelop azur softwaredesign softwaredevelop agil etl warehous develop data midsenior
Kolkata,microsoftazureinfrastructureascodeiacengin azur devop linux terraform visualstudio microsoft kubernet as midsenior
"Kochi/Cochin, Pune, Chennai, Bangalore/Bengaluru",azurecloudsolutionarchitect azur devop access script manag powerbi adb architectur senior
"Mumbai, Hyderabad/Secunderabad, Gurgaon/Gurugram, Bangalore/Bengaluru",azuredataengineerdatabricksdatawareh azuredataengin dataengin engin microsoftazur azuredatafactori warehous databrick sql midsenior
Bangalore/Bengaluru,azuredevopsengin infrastructureascod storag devop azuredevop cd snow terraform kanban associ
Bangalore/Bengaluru,windowsadministratorazurecloudplatform vmware infrastructur cloudplatform serv azurecloud sql server sqlazur midsenior
"Bangalore/ Bengaluru, Karnataka",azuredataengineerpythondatapipelinessqlserveradfadb azuredata databrick datapipelin python oracleadf sqlserver factori brick associ
Bangalore/Bengaluru,windowsserversadministrationvmwareazurecloud vmware windowsserveradministr ii azurecloud server applicationserv iisserv microsoftwindow midsenior
Bangalore/Bengaluru,azuredevopsengineercicdpipelin azuredevop continuousintegr pipelin cicdpipelin kubernet azurecloud cd docker associ
Kolkata,azuredataengin azuredatabrick azur azuredatafactori data microsoftazur brick databrick midsenior
Remote,azuredataengin azuredataengin pyspark datalak microsoftazur pytest factori data azuredatafactori senior
Mysore/Mysuru,azurecloudsrengg sql sr microsoftazur azurecloud cloud engin python associ
"Hybrid - Faridabad, Haryana",backenddevelopernetazur netcor net backend azur core microsoftazur backenddevelop develop midsenior
"Chennai, Tamil Nadu",netdeveloperwithazur c mandatoryazurefunct topic net event eventhub develop hub midsenior
"Hybrid - Nagpur, Maharashtra, Pune, Maharashtra, Chennai, Tamil Nadu, Bangalore/ Bengaluru, Karnataka",seniorclouddeveloperazur azuredevop python azurepaa develop paa senior sqlazur microsoftazur midsenior
"Mumbai, Bangalore/Bengaluru",seniorazuresqldba disasterrecov invest recoveri comput databasedesign sqldba dbm investmentbank midsenior
Bangalore/Bengaluru,azuresolutionarchitect azuresolut architectur paa powershel microsoft javascript bash saa senior
"Hyderabad/Secunderabad, Ahmedabad, Coimbatore, Bangalore/Bengaluru",seniorarchitectazuredevops2 devop technologymanag creativedesign manag cost sql architectur agil midsenior
Remote,azurearchitect azurearchitect architectur cloud virtual cloudmigr solutionarchitect cloudarchitectur infrastructur senior
"Chennai, Bangalore/Bengaluru",azurearchitect cloud paa iaa azurearchitect microsoftazur architectur execut
"Hybrid - Pune, Chennai, Bangalore/Bengaluru",azuredataarchitect azur dataarchitectur architectur data azuredatafactori microsoftazur senior
Pune,azuresolutionarchitect solutionarchitectur architectur paa cloud network datamanag networkmanag pearl senior
Remote,dotnetazurepaasdevelop framework develop agil entityframework aspnet frontend softwaretest unittest associ
Pune,applicationsolutionarchitectazurekubernetesservic azur kubernetesdeploy architectur ansibl puppet cloudarchitectur applic continuousintegr senior
Chennai,seniorazurecloudengin angularj net azurecloud senior microsoftazur cloud midsenior
"Mumbai, Pune",azuredataengineerclouddataengin dataengin spark cloud scala delta db directori adlsgen2 midsenior
Remote,seniorcloudengineerazur cloudcomput linux cloud gitlab troubleshoot comput jenkin senior associ
Bangalore/Bengaluru,cloudsqldbadeveloperawsazur databaseadministr azur dba databaseperformancetun administr aw sqldba serv midsenior
"Kochi/Cochin, Chennai, Bangalore/Bengaluru",azuredevopstechconsult devop azurekeyvault azuredevop terraform technicalanalysi keyvault microsoftazur vault midsenior
"Noida, Kochi/Cochin, Kolkata, Mumbai, Pune, Mysore/Mysuru, Coimbatore",azuredataarchitect azur datawareh microsoftazur data oracl python sql jenkin senior
Hyderabad/Secunderabad,leadazureengineerkubernetesdevop devop arm terraform docker helm cd code yaml midsenior
Hyderabad/Secunderabad,devopsengineerazurekubernet devop cicdpipelin kubernet vpn paa iaa docker jenkin associ
Hyderabad/Secunderabad,azuresolutionarchitectcloudservic azuresolut cloud powershel search elasticsearch cloudsecur azurecloud python senior
"Hybrid - Mohali, Punjab",azuredevopsengin cicd microsoft cd devop microsoftazur azuredevop cd continuousintegr associ
Hyderabad/Secunderabad,azuredatabricksengineerkafkasparksql azuredatabrick azuredatafactori dataingest kafka factori hive sqlazur microsoftazur associ
Mysore/Mysuru,srazuredevopssrengg azuredevop powershel engin agilemethodolog script agil microsoftazur devop midsenior
Hybrid - Hyderabad/Secunderabad,azuredevopsengin azuredevop devop microsoftazur midsenior
"Hybrid - Gurgaon/ Gurugram, Haryana",azuredevopsandterraformengin docker kubern appsupport terraform azuremonitor comput monitor grid associ
any,srdevopsengineerazureremot azur terraform docker devop kubernet sr remot python associ
Pune,ezestishiringazuredataengineerjoblocationpun azuredatalak python microsoftazur factori azuredatafactori data datalak hire midsenior
"Hybrid - Hyderabad/ Secunderabad, Telangana, Pune, Maharashtra, Coimbatore, Tamil Nadu",fulltimejobopportunityforazuredataengineerleadhyderabad azuredatafactori pyspark azuredatabrick brick leadership data sql databrick midsenior
Chennai,azuredevopsengin azur shellscript ansibl devop kubernet azuredevop cd continuousintegr associ
Remote,hiringazureciaengineernewtglobalpanindia terraform gitrepositori azuredatabas azuredevop pan devop configur hire midsenior
Remote,hiringforazuredatabricksengin azuredatabrick datawareh etl sql python data warehous pyspark midsenior
Bangalore/Bengaluru,microsoftazureiaasinfrastructureengin autom datamigr powershel json microsoft azureiaa migrat oper associ
Pune,azuredatafactorydevelop develop ssa data ssi factori sql azuredatafactori ssr associ
Hyderabad/Secunderabad,microsoftazureanalyticsservicesapplicationdevelop azureanalyt scala azuredatabrick bigdata dataarchitectur architectur develop team associ
Hyderabad/Secunderabad,microsoftazureanalyticsservicesapplicationdevelop analyt dataarchitectur businessprocess analyt scala azurehdinsight process azureanalyt associ
Hyderabad/Secunderabad,microsoftazuredataservicesapplicationdevelop azur postgresql azuredatabas architectur applicationdevelop mysql sql develop associ
Hyderabad/Secunderabad,microsoftazuredataservicesapplicationdevelop postgresql mysql sql dataarchitectur applic develop azuredatalak dataservic associ
Chennai,microsoftazureanalyticsservicesapplicationdevelop sqlqueri azureanalyt powerbi systemintegrationtest azuredatafactori systemintegr manag integrationtest associ
Pune,microsoftazureanalyticsservicesapplicationdevelop azur azuredatabrick azurehdinsight azuresynapseanalyt architectur spark azureanalysi microsoft associ
Pune,microsoftazureanalyticsservicesapplicationdevelop analyt dataarchitectur analyt scala analyticsservic pyspark data develop midsenior
Pune,microsoftazuredataservicesapplicationdevelop powershel azur git paa iaa devop dataservic develop associ
Mumbai,microsoftazuredataservicesapplicationdevelop azur ssi troubleshoot sql dataarchitectur microsoft data dataservic associ
Pune,microsoftazureanalyticsservicesapplicationdevelop scala analyt dataarchitectur microsoft azurestreamanalyt azureanalyt streamanalyt azuredatafactori midsenior
Pune,microsoftazuredataservicesapplicationdevelop git powershel paa microsoftazur microsoft cloud cloudappl data associ
Gurgaon/Gurugram,microsoftazuredevopsapplicationdevelop azur vst powershel microsoftazur continuousintegr continuousintegr git develop midsenior
Noida,microsoftazuredataservicesapplicationdevelop azur azuredataservic microsoft teammanagementskil devop azuredevop teammanag managementskil associ
"Hybrid - Pune, Maharashtra",seniordevopsengineerazur azur docker terraform kubernet azuredevop senior microsoftazur microsoft midsenior
"Mumbai, Thane",azuredevopsengin devopsengin devop engin cicd configur testplan azuredevop azurepipelin associ
Hyderabad/Secunderabad,azuredataengineerpysparkdatawareh pyspark datawareh etl bigdata integr erwin azuredatafactori data midsenior
Pune,azurel3engineeractivedirectorypowershel activedirectori l3 paa directori arm system ticket powershel midsenior
Hyderabad/Secunderabad,deputymanagercloudarchitectazur azur microsoft cloud cloudarchitectur manag secur itsecur comput associ
"Hyderabad/ Secunderabad, Telangana",azureactivedirectoryengin azureactivedirectori serv directoryservic advertis fsmo azureadconnect activedirectori grouppolici midsenior
"Ghaziabad, Pune, Gurgaon/Gurugram",azuredataengin azuredatafactori devop dbm tsql data sql jira datawareh associ
"Noida, Mumbai, Navi Mumbai, Pune, Greater Noida, Delhi / NCR",devopsengineerazurekubernet devop cicd nosql continuousintegr golang kubernet aw mysql midsenior
Greater Noida,azuredataengin azur warehous continuousintegr azuredatabrick data datawareh factori etl senior
"Chennai, Tamil Nadu",azuredataengin azur snowflak api data azuredatafactori microsoftazur python midsenior
"Pune, Maharashtra",azuredevopsengin azuredatafactori azuredevop armtempl data factori sql sqlazur templat associ
Pune,azuredevopsengin azureadminstr azuredevop administr microsoftazur devop midsenior
"Hyderabad/Secunderabad, Chennai, Bangalore/Bengaluru",netdeveloperazurecsqlserv c azur sqlserver ddl sqlazur webapi mvc dml midsenior
Bangalore/Bengaluru,netdeveloperazurestack azuredatafactori factori ado azureinfrastructur infrastructur azureanalysi nosql develop associ
Bangalore/Bengaluru,azuresparkdeveloperdatafactorydatabrick azuredatafactori databrick datapipelin datawareh develop datalak factori model midsenior
"Hybrid - Pune, Maharashtra",azuredevelop azur python azuredatafactori develop datalak factori azuredatalak pyspark midsenior
"Hybrid - Pune, Maharashtra",azuredataarchitect microsoftazurearchitectur warehous datalak azuredatabrick storag data azuredatalak architectur senior
Mysore/Mysuru,smeazurearchitect architectur git sme dicom tdd maven jira softwaredesign senior
Remote,azurearchitect azurecloud storag bu azurekeyvault comput logic search azurelogicapp senior
"Mumbai, Pune, Chennai, Ahmedabad",azuresolutionarchitect microsoft manag leadershipdevelop businessanalysi technologymanag rfp usag recruit senior
"Hybrid - Nagpur, Maharashtra, Pune, Maharashtra",clouddeveloperazur azuresynaps microsoftazur pyspark sql develop microsoft clouddevelop oracleadf midsenior
Mysore/Mysuru,azureiotarchitect applic develop integr jira continuousintegr git sdk drive senior
"Hybrid - Hyderabad/Secunderabad, Mumbai (All Areas)",leadconsultantazurevirtualdesktopavd desktop citrix consult microsoftazur avd midsenior
Hyderabad/Secunderabad,carbynetechtechnicalarchitectazureaspnet azur javascript technicalarchitectur shellscript architectur technic sql webapp midsenior
United States (USA),dotnetazureconsultantsmusthaveh1bvisa azur cloud consult dot h1b microsoftazur net aw midsenior
Bangalore/Bengaluru,experiencedazuredevopsengin azur devop applic nginx develop ansibl applicationdevelop aviat senior
Bangalore/Bengaluru,azuredataengin dataengin microsoft nosql dbm data scala python intellig associ
Remote,emidshiringazuredevopsengineer6yearsnightshiftwfh microsoftazur devop continuousintegr hire git azuredevop terraform github midsenior
"Pune, Maharashtra",expleowalkindrive2425junedevopsazureengineerpun devop azuredevop continuousintegr microsoftazur drive cicd cd associ
Bangalore/Bengaluru,azureawscloudspecialist analyt softwaredevelopmentlifecycl develop softwaredevelop itservic developmentlifecycl sdlc awscloud associ
"Hybrid - Bangalore/ Bengaluru, Karnataka",azuredevopsengin azurecloud ak helmchart armtempl bashscript chart bash docker midsenior
Bangalore/Bengaluru,azuredevopsengin oper configur azuredevop agil manag devop microsoftazur configurationmanag associ
Bangalore/Bengaluru,azuredevopssrengin devop azuredevop tcp jenkin datastructur configur aw ansibl midsenior
New Delhi,consultantdataengineerazur microsoft consult performancetun autom virtual data python telecom associ
Mumbai (All Areas),excellentjobopportunityforsrazurearchitect saa azurearchitect azur microsofttechnolog migrat architectur sr microsoftazur execut
Hybrid - Pune,azurearchitectnativeappdevelop azur manag nativ configurationmanag azureinfrastructur fullstack infrastructur architectur midsenior
